id;isbn;title;authors;language;avg-rating
2421;676979785;Musicophilia: Tales of Music and the Brain;Oliver Sacks;eng;3.88
2422;1501129740;End of Watch (Bill Hodges Trilogy, #3);Stephen King;eng;4.09
2423;60590319;Fool;Christopher Moore;en-US;3.96
2424;743298853;The Book of Lost Things;John Connolly;eng;3.98
2425;140003003X;My Life;Bill Clinton;eng;3.72
2426;1569714029;300;Frank Miller, Lynn Varley;en-US;3.93
2427;545060494;Storm Warning (The 39 Clues, #9);Linda Sue Park;eng;3.98
2428;1423128206;Only the Good Spy Young (Gallagher Girls, #4);Ally Carter;en-US;4.29
2429;440241006;Persuader (Jack Reacher, #7);Lee Child;eng;4.09
2430;425212890;Grave Sight (Harper Connelly, #1);Charlaine Harris;eng;3.85
2431;8203180728;Flaggermusmannen (Harry Hole, #1);Jo Nesbø, Don Bartlett;nor;3.56
2432;515143804;Blood Brothers (Sign of Seven, #1);Nora Roberts;eng;4.15
2433;425185508;Picture Perfect;Jodi Picoult;en-GB;3.52
2434;1591162203;Rurouni Kenshin, Vol. 1: Meiji Swordsman Romantic Story (Rurouni Kenshin, #1);Nobuhiro Watsuki, Kenichiro Yagi;eng;4.33
2435;1402262272;Catching Jordan;Miranda Kenneally;eng;3.85
2436;60730552;Touching the Void: The True Story of One Man's Miraculous Survival;Joe Simpson;eng;4.2
2437;;This Girl (Slammed, #3);Colleen Hoover;eng;4.18
2438;670869392;There Was an Old Lady Who Swallowed a Fly;Simms Taback;;4.2
2439;1932073205;Way of the Peaceful Warrior: A Book That Changes Lives;Dan Millman;en-US;4.13
2440;312270828;The Satanic Verses;Salman Rushdie;eng;3.71
2441;385523904;Nothing to Envy: Ordinary Lives in North Korea;Barbara Demick;eng;4.42
2442;60753943;Winning;Jack Welch, Suzy Welch;;3.8
2443;;Collide (Collide, #1);Gail McHugh;eng;4.24
2444;618620117;How We Decide;Jonah Lehrer;en-US;3.81
2445;553381520;The Beekeeper's Apprentice (Mary Russell, #1);Laurie R. King;en-US;4.08
2446;394805755;The Story of Babar;Jean de Brunhoff, Merle S. Haas;en-US;4.07
2447;385735332;The Warlock (The Secrets of the Immortal Nicholas Flamel, #5);Michael Scott;eng;4.17
2448;044101769X;First Lord's Fury (Codex Alera, #6);Jim Butcher;eng;4.37
2449;385343663;The Imperfectionists;Tom Rachman;eng;3.54
2450;;The Sea of Tranquility;Katja Millay;eng;4.34
2451;375714669;Persepolis 2: The Story of a Return (Persepolis, #2);Marjane Satrapi, Anjali Singh;eng;4.23
2452;61020656;Pyramids (Discworld, #7);Terry Pratchett;en-US;3.88
2453;586064176;Silverthorn (The Riftwar Saga, #3);Raymond E. Feist;en-GB;4.06
2454;385613466;Before I Die;Jenny Downham;eng;3.84
2455;670021652;Committed: A Skeptic Makes Peace with Marriage;Elizabeth Gilbert;eng;3.39
2456;142401765;Keeping the Moon;Sarah Dessen;en-US;3.86
2457;62285637;The Transfer (Divergent, #0.1);Veronica Roth;eng;4.19
2458;765344319;Chainfire (Sword of Truth, #9);Terry Goodkind;en-US;3.95
2459;375413405;Mastering the Art of French Cooking;Julia Child, Simone Beck, Louisette Bertholle;en-US;4.33
2460;1421540320;Blue Exorcist, Vol. 1  (Blue Exorcist, #1);Kazue Kato, John Werry;eng;4.36
2461;765315238;Confessor (Sword of Truth, #11);Terry Goodkind;en-US;4.08
2462;151013047;The Reluctant Fundamentalist;Mohsin Hamid;eng;3.67
2463;545284139;The False Prince (The Ascendance Trilogy #1);Jennifer A. Nielsen;eng;4.22
2464;449911659;Rabbit, Run (Rabbit Angstrom #1);John Updike;eng;3.57
2465;1400077427;Stumbling on Happiness;Daniel Todd Gilbert;eng;3.82
2466;015694877X;The Waste Land and Other Poems;T.S. Eliot;en-US;4.23
2467;590319671;Little Bear;Else Holmelund Minarik, Maurice Sendak;eng;4.22
2468;146000110;The Pit and the Pendulum;Edgar Allan Poe;eng;4.15
2469;055215315X;Lords and Ladies (Discworld, #14: Witches #4);Terry Pratchett;eng;4.14
2470;552152676;Thud! (Discworld, #34: City Watch #7);Terry Pratchett;eng;4.29
2471;345481283;His Majesty's Dragon (Temeraire, #1);Naomi Novik;eng;4.05
2472;689859368;The Field Guide (The Spiderwick Chronicles, #1);Holly Black, Tony DiTerlizzi;eng;3.85
2473;1601422210;Radical: Taking Back Your Faith from the American Dream;David Platt;eng;4.18
2474;140280197;The 48 Laws of Power;Robert Greene, Joost Elffers;;4.18
2475;142401110;My Side of the Mountain (Mountain, #1);Jean Craighead George;eng;4.03
2476;749080973;The Winter Sea (Slains, #1);Susanna Kearsley, Rosalyn Landor;eng;4.07
2477;545135702;The Sword Thief (The 39 Clues, #3);Peter Lerangis;eng;3.87
2478;451159535;Coma;Robin Cook;eng;3.86
2479;1560252480;Requiem for a Dream;Hubert Selby Jr., Darren Aronofsky, Richard Price;eng;4.1
2480;61284203;Into the Wild (Warriors, #1);Erin Hunter;eng;4.29
2481;805066691;Bury My Heart at Wounded Knee: An Indian History of the American West;Dee Brown;;4.21
2482;057506708X;The Pianist: The Extraordinary Story of One Man's Survival in Warsaw, 1939–45;Władysław Szpilman, Anthea Bell;;4.24
2483;425267040;Rush (Breathless, #1);Maya Banks;eng;3.97
2484;1411415930;The Picture of Dorian Gray: A Graphic Novel;Ian Edginton, Oscar Wilde, I.N.J. Culbard;eng;4.12
2485;671741039;Swan Song;Robert McCammon;eng;4.28
2486;030727103X;The Buried Giant;Kazuo Ishiguro;eng;3.42
2487;345459407;Perdido Street Station (Bas-Lag, #1);China Miéville;eng;3.96
2488;1599903385;Need (Need, #1);Carrie Jones;eng;3.71
2489;61020613;Witches Abroad (Discworld, #12: Witches #3);Terry Pratchett;eng;4.2
2490;014043769X;The Legend of Sleepy Hollow and Other Stories;Geoffrey Crayon, Washington Irving, William L. Hedges;eng;3.93
2491;441328008;Heretics of Dune (Dune Chronicles #5);Frank Herbert;eng;3.83
2492;515090255;The Cross and the Switchblade;David Wilkerson, John Sherrill, Elizabeth Sherrill;;4.2
2493;441015271;Captain's Fury (Codex Alera, #4);Jim Butcher;eng;4.38
2494;385671105;Damned (Damned, #1);Chuck Palahniuk;eng;3.38
2495;439443822;Rules;Cynthia Lord;;3.96
2496;307263991;Swamplandia!;Karen Russell;eng;3.21
2497;075280944X;The Last Coyote (Harry Bosch, #4: Harry Bosch Universe, #4);Michael Connelly;eng;4.21
2498;142001619;Salt: A World History;Mark Kurlansky;eng;3.73
2499;037575850X;Villette;Charlotte Brontë, A.S. Byatt, Μαρία Λαϊνά, Ignes Sodre;eng;3.75
2500;61977969;Reamde;Neal Stephenson;eng;3.96
2501;057506689X;Soul Music (Discworld, #16: Death, #3);Terry Pratchett;eng;4.02
2502;;Notorious Nineteen (Stephanie Plum, #19);Janet Evanovich;eng;3.9
2503;059306173X;The Greatest Show on Earth: The Evidence for Evolution;Richard Dawkins;en-GB;4.16
2504;1593072937;Sin City, Vol. 1: The Hard Goodbye (Sin City, #1);Frank Miller;eng;4.16
2505;055327757X;The Greatest Salesman in the World;Og Mandino;eng;4.19
2506;014200202X;Casino Royale (James Bond, #1);Ian Fleming;eng;3.73
2507;6513220;The Bronze Horseman (The Bronze Horseman, #1);Paullina Simons;eng;4.34
2508;452283868;Sula;Toni Morrison;en-US;3.86
2509;;The Atlantis Gene (The Origin Mystery, #1);A.G. Riddle;eng;3.69
2510;1416563725;The Red Queen (The Plantagenet and Tudor Novels, #3);Philippa Gregory;eng;3.74
2511;425233383;Something About You (FBI/US Attorney, #1);Julie James;eng;3.94
2512;7169914;Mr. Brown Can Moo! Can You?;Dr. Seuss;en-US;4.11
2513;034547063X;Black House (The Talisman, #2);Stephen King, Peter Straub;eng;3.99
2514;785123113;Marvel 1602;Neil Gaiman, Andy Kubert, Richard Isanove, Peter Sanderson;eng;3.93
2515;743270371;Act of Treason (Mitch Rapp, #9);Vince Flynn;en-US;4.28
2516;307959945;The Dog Stars;Peter Heller;;3.9
2517;;The Spy Who Came In from the Cold;John le Carré;eng;4.05
2518;441013406;Academ's Fury (Codex Alera, #2);Jim Butcher;eng;4.27
2519;446676438;When the Wind Blows (When the Wind Blows, #1);James Patterson;eng;3.92
2520;4103534222;1Q84 BOOK 1 (1Q84, #1);Haruki Murakami, 村上 春樹;jpn;3.96
2521;722534876;The Pilgrimage;Paulo Coelho, Alan R. Clarke;eng;3.64
2522;385336691;The Hard Way (Jack Reacher, #10);Lee Child;en-US;4.14
2523;440226708;The Incredible Journey;Sheila Burnford;eng;4.16
2524;143036661;March;Geraldine Brooks;en-US;3.73
2525;307749606;A Wanted Man (Jack Reacher, #17);Lee Child, Dick Hill;eng;4.0
2526;1401209149;All-Star Superman, Vol. 1;Grant Morrison, Frank Quitely;eng;4.06
2527;1780484259;A Song of Ice and Fire (A Song of Ice and Fire, #1-5);George R.R. Martin;eng;4.63
2528;425259854;Dark Witch (The Cousins O'Dwyer Trilogy, #1);Nora Roberts;eng;3.91
2529;312590970;Dark Flame (The Immortals, #4);Alyson Noel;eng;3.73
2530;1101990260;The Widow;Fiona Barton;eng;3.49
2531;545060451;The Black Circle (The 39 Clues, #5);Patrick Carman;en-US;4.0
2532;62248162;The Prince (The Selection, #0.5);Kiera Cass;;3.93
2533;374384681;The Winner's Curse (The Winner's Trilogy, #1);Marie Rutkoski;eng;4.03
2534;679766758;Push;Sapphire;eng;3.82
2535;1609451341;The Story of a New Name (The Neapolitan Novels #2);Elena Ferrante, Ann Goldstein;eng;4.37
2536;345413970;2010: Odyssey Two (Space Odyssey, #2);Arthur C. Clarke;eng;3.89
2537;759530017;Soul Eater, Vol. 01 (Soul Eater, #1);Atsushi Ohkubo;en-US;4.3
2538;1451645821;Ordinary Grace;William Kent Krueger;eng;4.14
2539;446611778;Last Man Standing;David Baldacci;eng;4.03
2540;1596431520;American Born Chinese;Gene Luen Yang;eng;3.88
2541;307001040;Peter Pan (A Little Golden Book);Eugene Bradley Coco, Ron Dias, Walt Disney Company;eng;4.32
2542;991686004;Ten Tiny Breaths (Ten Tiny Breaths, #1);K.A. Tucker;eng;4.16
2543;1400065453;The Thousand Autumns of Jacob de Zoet;David Mitchell;eng;4.03
2544;486282082;Dr. Faustus;Christopher Marlowe;eng;3.79
2545;312984839;Dance with the Devil (Dark-Hunter #3);Sherrilyn Kenyon;eng;4.39
2546;786887079;Lipstick Jungle;Candace Bushnell;eng;3.39
2547;446611212;Violets Are Blue (Alex Cross, #7);James Patterson;eng;3.94
2548;671791540;Awaken the Giant Within: How to Take Immediate Control of Your Mental, Emotional, Physical and Financial Destiny!;Anthony Robbins, Tony Robbins, Frederick L. Covan;eng;4.1
2549;515134457;Blue Moon (Anita Blake, Vampire Hunter, #8);Laurell K. Hamilton;en-US;4.04
2550;515134473;Burnt Offerings (Anita Blake, Vampire Hunter, #7);Laurell K. Hamilton;en-US;4.07
2551;1250010713;The Silent Sister (Riley MacPherson, #1);Diane Chamberlain;eng;3.93
2552;385333781;Player Piano;Kurt Vonnegut Jr.;eng;3.85
2553;812967259;The Lost World (Professor Challenger, #1);Arthur Conan Doyle;;3.92
2554;;Monstrous Regiment (Discworld, #31: Industrial Revolution, #3);Terry Pratchett;eng;4.18
2555;807083690;Kindred;Octavia E. Butler;eng;4.18
2556;60885424;The Long Winter (Little House, #6);Laura Ingalls Wilder, Garth Williams;;4.16
2557;310247454;Boundaries: When to Say Yes, How to Say No to Take Control of Your Life;Henry Cloud, John Townsend;en-US;4.19
2558;545424968;Blue Lily, Lily Blue (The Raven Cycle, #3);Maggie Stiefvater;eng;4.32
2559;99399016;Portnoy's Complaint;Philip Roth, Luca Marinelli;;3.69
2560;785274316;The 21 Irrefutable Laws of Leadership: Follow Them and People Will Follow You;John C. Maxwell, Zig Ziglar;eng;4.12
2561;385491026;Cat's Eye;Margaret Atwood;eng;3.92
2562;;The Perfect Game (The Perfect Game, #1);J. Sterling;eng;3.97
2563;1406310271;Monsters of Men (Chaos Walking, #3);Patrick Ness;eng;4.25
2564;1841492051;Shadow of the Giant (Ender's Shadow, #4);Orson Scott Card;eng;3.98
2565;545027896;Wonderstruck;Brian Selznick;eng;4.16
2566;446519138;Simple Abundance:  A Daybook of Comfort and Joy;Sarah Ban Breathnach;en-US;3.96
2567;1442429984;Blood Red Road (Dust Lands, #1);Moira Young;eng;3.94
2568;316014796;The 6th Target (Women's Murder Club, #6);James Patterson, Maxine Paetro;en-US;4.02
2569;143104888;A Princess of Mars (Barsoom, #1);Edgar Rice Burroughs, John Seelye;en-GB;3.8
2570;385528787;MaddAddam (MaddAddam, #3);Margaret Atwood;eng;3.98
2571;60264802;These Happy Golden Years (Little House, #8);Laura Ingalls Wilder, Garth Williams;eng;4.17
2572;812971426;Color: A Natural History of the Palette;Victoria Finlay;en-US;3.74
2573;99481685;Skipping Christmas;John Grisham;eng;3.47
2574;446613444;The Black Ice (Harry Bosch, #2: Harry Bosch Universe, #2);Michael Connelly;eng;4.05
2575;312577206;Home Front;Kristin Hannah;eng;4.12
2576;1476731535;Beautiful Stranger (Beautiful Bastard, #2);Christina Lauren;eng;4.24
2577;385730306;The Sweet Far Thing (Gemma Doyle, #3);Libba Bray;eng;3.97
2578;375702709;A Lesson Before Dying;Ernest J. Gaines;en-US;3.93
2579;349119759;SantaLand Diaries;David Sedaris;en-US;4.33
2580;1455520616;See Me;Nicholas Sparks;eng;3.93
2581;385342047;Mini Shopaholic (Shopaholic, #6);Sophie Kinsella;eng;3.7
2582;60268654;Harry the Dirty Dog;Gene Zion, Margaret Bloy Graham;en-US;4.17
2583;145161778X;All Fall Down;Jennifer Weiner;eng;3.61
2584;015626224X;Down and Out in Paris and London;George Orwell;en-US;4.1
2585;1427814031;Maid-sama! Vol. 01 (Maid-sama!, #1);Hiro Fujiwara;eng;4.4
2586;1551924013;Griffin and Sabine (Griffin & Sabine #1);Nick Bantock;eng;4.01
2587;080509461X;Ruin and Rising (Shadow and Bone, #3);Leigh Bardugo;eng;4.17
2588;9773513912;يوتوبيا;أحمد خالد توفيق;ara;3.9
2589;743294254;Certain Girls (Cannie Shapiro #2);Jennifer Weiner;eng;3.7
2590;030794932X;Tiny Beautiful Things: Advice on Love and Life from Dear Sugar;Cheryl Strayed;;4.29
2591;440244161;Beyond the Highland Mist (Highlander, #1);Karen Marie Moning;eng;3.99
2592;451203267;The Stranger Beside Me: Ted Bundy The Shocking Inside Story;Ann Rule;en-GB;4.13
2593;61284408;Stargazer (Evernight, #2);Claudia Gray;eng;3.8
2594;606298231;Rising Sun;Michael Crichton;eng;3.61
2595;440060672;The Other Side of Midnight (Midnight #1);Sidney Sheldon;eng;3.89
2596;316069485;The Reversal (Harry Bosch, #16: Mickey Haller, #4: Harry Bosch Universe, #19);Michael Connelly;eng;4.13
2597;380731509;Wayside School Is Falling Down (Wayside School #2);Louis Sachar, Joel Schick;eng;4.17
2598;307713547;The Invisible Bridge;Julie Orringer, Arthur Morey;eng;4.19
2599;61974618;The Fall of Five (Lorien Legacies, #4);Pittacus Lore;eng;4.24
2600;141439785;The Mayor of Casterbridge;Thomas Hardy, Keith Wilson;eng;3.8
2601;;The Red Pony;John Steinbeck;;3.42
2602;99478536;The Devil's Star (Harry Hole, #5);Jo Nesbø;eng;4.03
2603;425169693;Here on Earth;Alice Hoffman;eng;3.68
2604;679436545;Taltos (Lives of the Mayfair Witches, #3);Anne Rice, Tim Curry;;3.78
2605;;Obsidian Butterfly (Anita Blake, Vampire Hunter, #9);Laurell K. Hamilton;eng;4.08
2606;345503821;The Daylight War (Demon Cycle, #3);Peter V. Brett;eng;4.23
2607;385515049;The Appeal;John Grisham;en-US;3.58
2608;689878583;The Woman Who Rides Like a Man (Song of the Lioness, #3);Tamora Pierce;en-US;4.2
2609;034552425X;Midnight Riot (Peter Grant, #1);Ben Aaronovitch;eng;3.92
2610;60090375;Lucy Sullivan Is Getting Married;Marian Keyes;en-US;3.74
2611;055255264X;A Hat Full of Sky (Discworld, #32: Tiffany Aching, #2);Terry Pratchett;eng;4.29
2612;60786523;A Suitable Boy (A Suitable Boy, #1);Vikram Seth;en-US;4.1
2613;;We Should All Be Feminists;Chimamanda Ngozi Adichie;eng;4.47
2614;1841497975;River Marked (Mercy Thompson, #6);Patricia Briggs;en-GB;4.26
2615;446578843;I Like You: Hospitality Under the Influence;Amy Sedaris;eng;3.87
2616;425198685;Pattern Recognition (Blue Ant, #1);William Gibson;eng;3.86
2617;62267523;The Kind Worth Killing;Peter  Swanson;eng;4.03
2618;761104844;1,000 Places to See Before You Die;Patricia Schultz;;3.83
2619;60577371;Physik (Septimus Heap, #3);Angie Sage, Mark Zug;en-US;3.99
2620;141311401;Boy: Tales of Childhood;Roald Dahl, Quentin Blake;eng;4.09
2621;385496095;Traveling Mercies: Some Thoughts on Faith;Anne Lamott;en-CA;4.15
2622;1416548009;Memorial Day (Mitch Rapp, #7);Vince Flynn;eng;4.3
2623;1416903437;Wild Magic (Immortals, #1);Tamora Pierce;en-US;4.32
2624;;Prelude to Foundation;Isaac Asimov;eng;4.05
2625;1859855423;You Are Special (Wemmicksville, #1);Max Lucado;eng;4.45
2626;399171614;The Wrath and the Dawn (The Wrath and the Dawn, #1);Renee Ahdieh;eng;4.19
2627;307267148;Half the Sky: Turning Oppression into Opportunity for Women Worldwide;Nicholas D. Kristof, Sheryl WuDunn;eng;4.31
2628;316127256;Why We Broke Up;Daniel Handler, Maira Kalman;eng;3.49
2629;1408852594;The Assassin's Blade (Throne of Glass, #0.1-0.5);Sarah J. Maas;eng;4.48
2630;1400064759;American Wife;Curtis Sittenfeld;eng;3.72
2631;441014348;Cursor's Fury (Codex Alera, #3);Jim Butcher;eng;4.36
2632;449912558;The Sparrow (The Sparrow, #1);Mary Doria Russell;eng;4.17
2633;743422449;Mercy;Jodi Picoult;en-GB;3.57
2634;1477823832;The Paper Magician (The Paper Magician Trilogy, #1);Charlie N. Holmberg;eng;3.63
2635;61728977;Act Like a Lady, Think Like a Man: What Men Really Think About Love, Relationships, Intimacy, and Commitment;Steve Harvey;;3.82
2636;385526261;Destiny of the Republic: A Tale of Madness, Medicine and the Murder of a President;Candice Millard;en-US;4.19
2637;143039970;We Have Always Lived in the Castle;Shirley Jackson, Jonathan Lethem;eng;4.05
2638;1591451876;Love and Respect: The Love She Most Desires: The Respect He Desperately Needs;Emerson Eggerichs;;4.17
2639;316166294;The Brass Verdict (Harry Bosch, #14: Mickey Haller, #2: Harry Bosch Universe, #17);Michael Connelly;eng;4.08
2640;553560719;Dark Force Rising;Timothy Zahn;en-US;4.14
2641;385344341;Never Go Back (Jack Reacher, #18);Lee Child;eng;4.02
2642;60575808;The Two Princesses of Bamarre;Gail Carson Levine;eng;4.02
2643;60929782;Black Boy;Richard Wright, Jerry W. Ward Jr.;en-US;4.02
2644;446678457;Cane River;Lalita Tademy;en-US;4.04
2645;765305240;Phantom (Sword of Truth, #10);Terry Goodkind;;3.99
2646;553587579;Foundation and Earth (Foundation #5);Isaac Asimov;eng;4.02
2647;553384155;Flags of Our Fathers;James D. Bradley, Ron Powers;;4.18
2648;525444475;The World of Winnie-the-Pooh (Winnie-the-Pooh, #1-2);A.A. Milne, Ernest H. Shepard;eng;4.43
2649;807059099;The Story of My Experiments With Truth;Mahatma Gandhi;eng;4.07
2650;425179613;It's Not About the Bike: My Journey Back to Life;Lance Armstrong, Sally Jenkins;en-US;3.72
2651;074347788X;Undaunted Courage: The Pioneering First Mission to Explore America's Wild Frontier;Stephen E. Ambrose;eng;4.22
2652;224097008;H is for Hawk;Helen Macdonald;eng;3.74
2653;034089699X;Us;David Nicholls;eng;3.66
2654;1560760478;Sojourn (Forgotten Realms: The Dark Elf Trilogy, #3: Legend of Drizzt, #3);R.A. Salvatore;eng;4.23
2655;785135804;Ender's Game, Volume 1: Battle School (Ender's Saga);Christopher Yost, Orson Scott Card, Pasqual Ferry, Frank D'Armata;en-US;4.37
2656;1421527553;Kimi ni Todoke: From Me to You, Vol. 1;Karuho Shiina, Tomo Kimura;eng;4.23
2657;553580221;False Memory;Dean Koontz;en-US;3.87
2658;552152943;Moving Pictures (Discworld, #10: Industrial Revolution, #1);Terry Pratchett;eng;3.91
2659;;Captive in the Dark (The Dark Duet, #1);C.J. Roberts;eng;4.01
2660;1585425648;As a Man Thinketh;James Allen;eng;4.29
2661;393064646;Bonk: The Curious Coupling of Science and Sex;Mary Roach;en-US;3.83
2662;451222385;Midnight Alley (The Morganville Vampires, #3);Rachel Caine;eng;4.11
2663;553418777;The Little Paris Bookshop;Nina George, Simon Pare;eng;3.51
2664;224097377;Sweet Tooth;Ian McEwan;eng;3.4
2665;;Twisted Perfection (Rosemary Beach, #5: Perfection, #1);Abbi Glines;eng;4.26
2666;6479758;Executive Orders (Jack Ryan Universe, #9);Tom Clancy;eng;4.04
2667;310321913;One Thousand Gifts: A Dare to Live Fully Right Where You Are;Ann Voskamp;eng;4.03
2668;747545251;Psycho;Robert Bloch;eng;4.09
2669;000649885X;Ship of Magic (Liveship Traders, #1);Robin Hobb;eng;4.12
2670;1560254556;Where Eagles Dare ;Alistair MacLean, Clint Willis;;4.12
2671;99498596;Circle of Friends;Maeve Binchy;eng;4.0
2672;1502784270;Milk and Honey;Rupi Kaur;eng;4.27
2673;425170349;Rainbow Six (Jack Ryan Universe, #10);Tom Clancy;en-US;4.07
2674;60515228;Fragile Things: Short Fictions and Wonders;Neil Gaiman;eng;4.02
2675;749942010;Sister;Rosamund Lupton;eng;3.77
2676;765377063;The Three-Body Problem (Remembrance of Earth’s Past, #1);Liu Cixin, Ken Liu;eng;4.0
2677;61031321;Thief of Time (Discworld, #26: Death, #5);Terry Pratchett;eng;4.25
2678;1401201911;Superman: Red Son;Mark Millar, Kilian Plunkett, Andrew Robinson, Walden Wong, Dave Johnson;eng;4.17
2679;385721420;Three Junes;Julia Glass;eng;3.56
2680;743255062;The Autobiography of Benjamin Franklin;Benjamin Franklin, Lewis Leary;eng;3.83
2681;525950494;The Reason for God: Belief in an Age of Skepticism;Timothy J. Keller;eng;4.2
2682;1937007472;King of Thorns (The Broken Empire, #2);Mark  Lawrence;en-US;4.2
2683;1250000971;The Sins of the Father (The Clifton Chronicles, #2);Jeffrey Archer;eng;4.01
2684;60725117;Shadowland (The Mediator, #1);Meg Cabot;eng;4.04
2685;61566128;Killer (Pretty Little Liars, #6);Sara Shepard;eng;4.07
2686;1591396190;Blue Ocean Strategy: How To Create Uncontested Market Space And Make The Competition Irrelevant;W. Chan Kim, Renée Mauborgne;;3.86
2687;316036196;Fang (Maximum Ride, #6);James Patterson;eng;4.07
2688;553807226;The Peach Keeper;Sarah Addison Allen;en-US;3.84
2689;152026320;The Napping House;Audrey Wood, Don    Wood;;4.27
2690;;The Short Drop (Gibson Vaughn, #1);Matthew FitzSimmons;eng;4.15
2691;60590297;You Suck (A Love Story, #2);Christopher Moore;eng;3.82
2692;;Beautiful Oblivion (The Maddox Brothers, #1);Jamie McGuire;eng;4.13
2693;812515285;A Fire Upon the Deep (Zones of Thought, #1);Vernor Vinge;eng;4.13
2694;1577311957;Practicing the Power of Now: Essential Teachings, Meditations, and Exercises from the Power of Now;Eckhart Tolle;;4.25
2695;038532328X;The Face on the Milk Carton (Janie Johnson, #1);Caroline B. Cooney;en-US;3.72
2696;067984483X;Put Me in the Zoo;Robert Lopshire;eng;4.13
2697;61935085;Firelight (Firelight, #1);Sophie Jordan;en-US;3.88
2698;156453800;Invisible Cities;Italo Calvino, William Weaver;eng;4.19
2699;;Flat-Out Love (Flat-Out Love, #1);Jessica Park;eng;4.01
2700;1741666708;The Narrow Road to the Deep North;Richard Flanagan;eng;4.0
2701;452281423;The Claiming of Sleeping Beauty (Sleeping Beauty, #1);A.N. Roquelaure, Anne Rice;en-US;3.28
2702;143116231;The Midwife: A Memoir of Birth, Joy, and Hard Times;Jennifer Worth;en-US;4.17
2703;222109073X;Hell's Angels: A Strange and Terrible Saga;Hunter S. Thompson;fre;4.0
2704;1451617720;Then Came You;Jennifer Weiner;en-US;3.69
2705;61020001;The Awakening (The Vampire Diaries, #1);L.J. Smith;eng;3.41
2706;380776839;It Had to Be You (Chicago Stars, #1);Susan Elizabeth Phillips;eng;4.04
2707;393343448;Boomerang: Travels in the New Third World;Michael   Lewis;eng;3.87
2708;743294270;Fly Away Home;Jennifer Weiner;eng;3.66
2709;140447644;The Red and the Black;Stendhal, Roger Gard;eng;3.87
2710;743269268;The Virgin's Lover (The Plantagenet and Tudor Novels, #13);Philippa Gregory;en-US;3.69
2711;340893605;Incarceron (Incarceron, #1);Catherine Fisher;eng;3.64
2712;312624689;Awake at Dawn (Shadow Falls, #2);C.C. Hunter;en-US;4.29
2713;451213041;The Road to the Dark Tower: Exploring Stephen King's Magnum Opus;Bev Vincent;;4.29
2714;62011995;Starcrossed (Starcrossed, #1);Josephine Angelini;en-US;4.08
2715;312590989;Night Star (The Immortals, #5);Alyson Noel;eng;3.82
2716;553282980;Dead Poets Society;N.H. Kleinbaum;eng;4.21
2717;;Wreckage;Emily Bleeker;en-GB;3.66
2718;552154229;The Fifth Elephant (Discworld, #24: City Watch, #5);Terry Pratchett;eng;4.24
2719;1741661285;The Sorcerer in the North (Ranger's Apprentice, #5);John Flanagan;eng;4.25
2720;876120834;Autobiography of a Yogi;Paramahansa Yogananda;en-US;4.22
2721;345522494;Hexed (The Iron Druid Chronicles, #2);Kevin Hearne;eng;4.22
2722;590431978;Scary Stories to Tell in the Dark (Scary Stories, #1);Alvin Schwartz, Stephen Gammell;eng;4.05
2723;525955097;Fool Me Once;Harlan Coben;eng;3.9
2724;679721037;Hiroshima;John Hersey;eng;3.94
2725;316041440;Hate List;Jennifer Brown;eng;4.03
2726;62235656;The Distance Between Us;Kasie West;eng;3.95
2727;517223120;A History of God: The 4,000-Year Quest of Judaism, Christianity, and Islam;Karen Armstrong;eng;3.85
2728;316129070;Abaddon's Gate (The Expanse, #3);James S.A. Corey;eng;4.18
2729;143039962;Twenty Love Poems and a Song of Despair;Pablo Neruda, W.S. Merwin, Cristina García;eng;4.33
2730;425116840;The Cardinal of the Kremlin (Jack Ryan Universe, #5);Tom Clancy;en-US;4.01
2731;590930028;No, David!;David Shannon;en-US;4.11
2732;140449108;Utopia;Thomas More, Paul Turner;eng;3.5
2733;316113662;The Name of This Book Is Secret (Secret, #1);Pseudonymous Bosch, Gilbert Ford;en-US;4.04
2734;62280678;Dorothy Must Die (Dorothy Must Die, #1);Danielle  Paige;eng;3.84
2735;553804790;The Husband;Dean Koontz;eng;3.8
2736;385501129;The Particular Sadness of Lemon Cake;Aimee Bender;eng;3.19
2737;446610224;The Big Bad Wolf  (Alex Cross, #9);James Patterson;en-US;3.97
2738;385722206;Balzac and the Little Chinese Seamstress;Dai Sijie, Ina Rilke;en-US;3.63
2739;62282719;Bad Feminist;Roxane Gay;eng;3.91
2740;671729470;Petals on the Wind (Dollanganger, #2);V.C. Andrews;en-US;3.82
2741;375814256;Danny the Champion of the World;Roald Dahl, Quentin Blake;;4.07
2742;1594202842;Battle Hymn of the Tiger Mother;Amy Chua;eng;3.61
2743;;Nimona;Noelle Stevenson;eng;4.2
2744;1400052580;Everyday Italian: 125 Simple and Delicious Recipes;Giada De Laurentiis;;3.97
2745;425204693;From Potter's Field (Kay Scarpetta, #6);Patricia Cornwell;eng;4.02
2746;446619035;Mary, Mary (Alex Cross, #11);James Patterson;eng;3.93
2747;;Oranges Are Not the Only Fruit;Jeanette Winterson;eng;3.75
2748;;Grounded (Up in the Air, #3);R.K. Lilley;en-GB;4.29
2749;8188575704;I Too Had a Love Story;Ravinder Singh;eng;3.64
2750;64401480;Mrs. Piggle-Wiggle (Mrs. Piggle Wiggle, #1);Betty MacDonald, Alexandra Boiger;eng;4.16
2751;312941919;Trunk Music (Harry Bosch, #5: Harry Bosch Universe, #6);Michael Connelly;eng;4.15
2752;62265423;10% Happier: How I Tamed the Voice in My Head, Reduced Stress Without Losing My Edge, and Found Self-Help That Actually Works;Dan   Harris;eng;3.93
2753;1400054346;Barefoot Contessa at Home: Everyday Recipes You'll Make Over and Over Again;Ina Garten, Quentin Bacon;;4.16
2754;446690449;Blood Work (Harry Bosch Universe, #8: Terry McCaleb #1);Michael Connelly;eng;4.11
2755;1857989341;The Gods Themselves;Isaac Asimov;eng;4.08
2756;545060478;The Viper's Nest (39 Clues, #7);Peter Lerangis;eng;3.97
2757;60838744;Ahab's Wife, or The Star-Gazer;Sena Jeter Naslund;en-US;4.02
