id;isbn;title;authors;language;avg-rating
1;439023483;The Hunger Games (The Hunger Games, #1);Suzanne Collins;eng;4.34
2;439554934;Harry Potter and the Sorcerer's Stone (Harry Potter, #1);J.K. Rowling, Mary GrandPré;eng;4.44
3;316015849;Twilight (Twilight, #1);Stephenie Meyer;en-US;3.57
4;61120081;To Kill a Mockingbird;Harper Lee;eng;4.25
5;743273567;The Great Gatsby;F. Scott Fitzgerald;eng;3.89
6;525478817;The Fault in Our Stars;John Green;eng;4.26
7;618260307;The Hobbit;J.R.R. Tolkien;en-US;4.25
8;316769177;The Catcher in the Rye;J.D. Salinger;eng;3.79
9;1416524797;Angels & Demons  (Robert Langdon, #1);Dan Brown;en-CA;3.85
10;679783261;Pride and Prejudice;Jane Austen;eng;4.24
11;1594480001;The Kite Runner;Khaled Hosseini;eng;4.26
12;62024035;Divergent (Divergent, #1);Veronica Roth;eng;4.24
13;451524934;1984;George Orwell, Erich Fromm, Celâl Üster;eng;4.14
14;452284244;Animal Farm;George Orwell;eng;3.87
15;553296981;The Diary of a Young Girl;Anne Frank, Eleanor Roosevelt, B.M. Mooyaart-Doubleday;eng;4.1
16;307269752;The Girl with the Dragon Tattoo (Millennium, #1);Stieg Larsson, Reg Keeland;eng;4.11
17;439023491;Catching Fire (The Hunger Games, #2);Suzanne Collins;eng;4.3
18;043965548X;Harry Potter and the Prisoner of Azkaban (Harry Potter, #3);J.K. Rowling, Mary GrandPré, Rufus Beck;eng;4.53
19;618346252;The Fellowship of the Ring (The Lord of the Rings, #1);J.R.R. Tolkien;eng;4.34
20;439023513;Mockingjay (The Hunger Games, #3);Suzanne Collins;eng;4.03
21;439358078;Harry Potter and the Order of the Phoenix (Harry Potter, #5);J.K. Rowling, Mary GrandPré;eng;4.46
22;316166685;The Lovely Bones;Alice Sebold;eng;3.77
23;439064864;Harry Potter and the Chamber of Secrets (Harry Potter, #2);J.K. Rowling, Mary GrandPré;eng;4.37
24;439139600;Harry Potter and the Goblet of Fire (Harry Potter, #4);J.K. Rowling, Mary GrandPré;eng;4.53
25;545010225;Harry Potter and the Deathly Hallows (Harry Potter, #7);J.K. Rowling, Mary GrandPré;eng;4.61
26;307277674;The Da Vinci Code (Robert Langdon, #2);Dan Brown;eng;3.79
27;439785960;Harry Potter and the Half-Blood Prince (Harry Potter, #6);J.K. Rowling, Mary GrandPré;eng;4.54
28;140283331;Lord of the Flies;William Golding;eng;3.64
29;743477111;Romeo and Juliet;William Shakespeare, Robert           Jackson;eng;3.73
30;297859382;Gone Girl;Gillian Flynn;eng;4.03
31;399155341;The Help;Kathryn Stockett;eng;4.45
32;142000671;Of Mice and Men;John Steinbeck;eng;3.84
33;739326228;Memoirs of a Geisha;Arthur Golden;eng;4.08
34;1612130291;Fifty Shades of Grey (Fifty Shades, #1);E.L. James;eng;3.67
35;61122416;The Alchemist;Paulo Coelho, Alan R. Clarke;eng;3.82
36;385732554;The Giver (The Giver, #1);Lois Lowry;eng;4.12
37;60764899;The Lion, the Witch, and the Wardrobe (Chronicles of Narnia, #1);C.S. Lewis;eng;4.19
38;965818675;The Time Traveler's Wife;Audrey Niffenegger;eng;3.95
39;553588486;A Game of Thrones (A Song of Ice and Fire, #1);George R.R. Martin;eng;4.45
40;143038419;Eat, Pray, Love;Elizabeth Gilbert;eng;3.51
41;786838655;The Lightning Thief (Percy Jackson and the Olympians, #1);Rick Riordan;eng;4.23
42;451529308;Little Women (Little Women, #1);Louisa May Alcott;en-US;4.04
43;142437204;Jane Eyre;Charlotte Brontë, Michael Mason;eng;4.1
44;553816713;The Notebook (The Notebook, #1);Nicholas Sparks;eng;4.06
45;770430074;Life of Pi;Yann Martel;;3.88
46;1565125606;Water for Elephants;Sara Gruen;eng;4.07
47;375831002;The Book Thief;Markus Zusak;eng;4.36
48;307347974;Fahrenheit 451;Ray Bradbury;spa;3.97
49;316160199;New Moon (Twilight, #2);Stephenie Meyer;eng;3.52
50;60513039;Where the Sidewalk Ends;Shel Silverstein;eng;4.29
51;1416914285;City of Bones (The Mortal Instruments, #1);Cassandra Clare;eng;4.12
52;316160202;Eclipse (Twilight, #3);Stephenie Meyer;en-US;3.69
53;375826696;Eragon (The Inheritance Cycle, #1);Christopher Paolini;en-US;3.86
54;345391802;The Hitchhiker's Guide to the Galaxy (Hitchhiker's Guide to the Galaxy, #1);Douglas Adams;en-US;4.2
55;60929871;Brave New World;Aldous Huxley;eng;3.97
56;031606792X;Breaking Dawn (Twilight, #4);Stephenie Meyer;en-US;3.7
57;142001740;The Secret Life of Bees;Sue Monk Kidd;en-US;4.01
58;142437174;The Adventures of Huckleberry Finn;Mark Twain, John Seelye, Guy Cardwell;eng;3.8
59;64410935;Charlotte's Web;E.B. White, Garth Williams, Rosemary Wells;eng;4.15
60;1400032717;The Curious Incident of the Dog in the Night-Time;Mark Haddon;eng;3.85
61;1594633665;The Girl on the Train;Paula Hawkins;eng;3.88
62;679879242;The Golden Compass (His Dark Materials, #1);Philip Pullman;eng;3.94
63;393978893;Wuthering Heights;Emily Brontë, Richard J. Dunn;eng;3.82
64;743454537;My Sister's Keeper;Jodi Picoult;eng;4.06
65;385333846;Slaughterhouse-Five;Kurt Vonnegut Jr.;eng;4.06
66;446675539;Gone with the Wind;Margaret Mitchell;eng;4.28
67;1594489505;A Thousand Splendid Suns;Khaled Hosseini;eng;4.34
68;671027344;The Perks of Being a Wallflower;Stephen Chbosky;eng;4.21
69;7442912;Insurgent (Divergent, #2);Veronica Roth;eng;4.07
70;812550706;Ender's Game (Ender's Saga, #1);Orson Scott Card;eng;4.3
71;141439475;Frankenstein;Mary Wollstonecraft Shelley, Percy Bysshe Shelley, Maurice Hindle;eng;3.75
72;450040186;The Shining (The Shining #1);Stephen King;eng;4.17
73;316068047;The Host (The Host, #1);Stephenie Meyer;en-US;3.84
74;142402516;Looking for Alaska;John Green;eng;4.09
75;014028009X;Bridget Jones's Diary (Bridget Jones, #1);Helen Fielding;eng;3.75
76;141439661;Sense and Sensibility;Jane Austen, Tony Tanner, Ros Ballaster;eng;4.06
77;439244196;Holes (Holes, #1);Louis Sachar, Louis Sachar;eng;3.93
78;307275558;The Devil Wears Prada (The Devil Wears Prada, #1);Lauren Weisberger;eng;3.7
79;143039954;The Odyssey;Homer, Robert Fagles, E.V. Rieu, Frédéric Mugler, Bernard Knox;eng;3.73
80;156012197;The Little Prince;Antoine de Saint-Exupéry, Richard Howard, Dom Marcos Barbosa, Melina Karakosta;eng;4.28
81;074324754X;The Glass Castle;Jeannette Walls;eng;4.24
82;385486804;Into the Wild;Jon Krakauer;eng;3.94
83;141439602;A Tale of Two Cities;Charles Dickens, Richard Maxwell, Hablot Knight Browne;eng;3.81
84;030734813X;Jurassic Park (Jurassic Park, #1);Michael Crichton;spa;3.96
85;60256656;The Giving Tree;Shel Silverstein;eng;4.38
86;385338600;A Time to Kill;John Grisham;eng;4.03
87;374500010;Night (The Night Trilogy #1);Elie Wiesel, Marion Wiesel;eng;4.3
88;014241493X;Paper Towns;John Green;en-US;3.88
89;345418263;The Princess Bride ;William Goldman;en-US;4.25
90;014038572X;The Outsiders;S.E. Hinton;en-US;4.06
91;385737947;The Maze Runner (Maze Runner, #1);James Dashner;eng;4.02
92;61234001;Freakonomics: A Rogue Economist Explores the Hidden Side of Everything (Freakonomics, #1);Steven D. Levitt, Stephen J. Dubner;en-US;3.93
93;517189607;The Secret Garden;Frances Hodgson Burnett;eng;4.12
94;60531045;One Hundred Years of Solitude;Gabriel García Márquez, Gregory Rabassa;eng;4.04
95;375751513;The Picture of Dorian Gray;Oscar Wilde, Jeffrey Eugenides;eng;4.06
96;345803507;Fifty Shades Freed (Fifty Shades, #3);E.L. James;eng;3.88
97;393970124;Dracula;Bram Stoker, Nina Auerbach, David J. Skal;eng;3.98
98;307269981;The Girl Who Played with Fire (Millennium, #2);Stieg Larsson, Reg Keeland;eng;4.22
99;1612130585;Fifty Shades Darker (Fifty Shades, #2);E.L. James;eng;3.87
100;60786507;The Poisonwood Bible;Barbara Kingsolver;eng;4.02
101;349113912;Me Talk Pretty One Day;David Sedaris;eng;3.97
102;99408392;Where the Wild Things Are;Maurice Sendak;eng;4.22
103;140449264;The Count of Monte Cristo;Alexandre Dumas, Robin Buss;eng;4.21
104;307265439;The Road;Cormac McCarthy;eng;3.95
105;7524277;Allegiant (Divergent, #3);Veronica Roth;eng;3.63
106;;Bossypants;Tina Fey;eng;3.94
107;446693804;A Walk to Remember;Nicholas Sparks;en-US;4.15
108;440241413;Confessions of a Shopaholic (Shopaholic, #1);Sophie Kinsella;eng;3.61
109;451525264;Les Misérables;Victor Hugo, Lee Fahnestock, Norman MacAfee;eng;4.14
110;553381695;A Clash of Kings  (A Song of Ice and Fire, #2);George R.R. Martin;eng;4.4
111;143037145;The Memory Keeper's Daughter;Kim Edwards;eng;3.64
112;670026603;Me Before You (Me Before You, #1);Jojo Moyes;eng;4.27
113;684833395;Catch-22;Joseph Heller;en-US;3.98
114;751529818;Tuesdays with Morrie;Mitch Albom, Saulius Dagys;eng;4.06
115;312422156;Middlesex;Jeffrey Eugenides;en-US;3.98
116;143039563;The Adventures of Tom Sawyer;Mark Twain, Guy Cardwell, John Seelye;eng;3.89
117;440498058;A Wrinkle in Time (A Wrinkle in Time Quintet, #1);Madeleine L'Engle;en-US;4.04
118;143038095;The Joy Luck Club;Amy Tan;eng;3.9
119;038549081X;The Handmaid's Tale;Margaret Atwood;eng;4.06
120;385729332;The Sisterhood of the Traveling Pants (Sisterhood, #1);Ann Brashares;eng;3.75
121;;Lolita;Vladimir Nabokov, Craig Raine;eng;3.88
122;60987103;Wicked: The Life and Times of the Wicked Witch of the West (The Wicked Years, #1);Gregory Maguire, Douglas Smith;eng;3.52
123;582418275;The Firm (Penguin Readers, Level 5);John Grisham;eng;3.99
124;316098337;Room;Emma Donoghue;eng;4.03
125;521618746;Hamlet;William Shakespeare, Richard Andrews, Rex Gibson;eng;4.0
126;340839937;Dune (Dune Chronicles #1);Frank Herbert;eng;4.19
127;316346624;The Tipping Point: How Little Things Can Make a Big Difference;Malcolm Gladwell;eng;3.92
128;1451648537;Steve Jobs;Walter Isaacson;eng;4.09
129;451163966;One Flew Over the Cuckoo's Nest;Ken Kesey;eng;4.18
130;684830493;The Old Man and the Sea;Ernest Hemingway;eng;3.73
131;142000663;The Grapes of Wrath;John Steinbeck;eng;3.92
132;1401308589;The Five People You Meet in Heaven;Mitch Albom;;3.9
133;451528824;Anne of Green Gables (Anne of Green Gables, #1);L.M. Montgomery;eng;4.23
134;1416914307;City of Glass (The Mortal Instruments, #3);Cassandra Clare;en-US;4.34
135;055357342X;A Storm of Swords (A Song of Ice and Fire, #3);George R.R. Martin;eng;4.54
136;006075995X;Divine Secrets of the Ya-Ya Sisterhood;Rebecca Wells;en-US;3.79
137;440242940;Outlander (Outlander, #1);Diana Gabaldon;eng;4.2
138;142437263;The Scarlet Letter;Nathaniel Hawthorne, Thomas E. Connolly, Nina Baym;eng;3.37
139;1594744769;Miss Peregrine’s Home for Peculiar Children (Miss Peregrine’s Peculiar Children, #1);Ransom Riggs;en-US;3.89
140;030726999X;The Girl Who Kicked the Hornet's Nest (Millennium, #3);Stieg Larsson, Reg Keeland;en-US;4.2
141;804139024;The Martian;Andy Weir;eng;4.39
142;451207149;The Pillars of the Earth (The Kingsbridge Series, #1);Ken Follett;eng;4.29
143;1476746583;All the Light We Cannot See;Anthony Doerr;eng;4.31
144;1400064163;Unbroken: A World War II Story of Survival, Resilience, and Redemption;Laura Hillenbrand;eng;4.4
145;671027387;Deception Point;Dan Brown;eng;3.67
146;316055433;The Goldfinch;Donna Tartt;eng;3.87
147;1595141715;Thirteen Reasons Why;Jay Asher;eng;4.02
148;452287022;Girl with a Pearl Earring;Tracy Chevalier;eng;3.85
149;525421033;If I Stay (If I Stay, #1);Gayle Forman;en-US;3.96
150;312353766;The Red Tent;Anita Diamant;en-US;4.16
151;786856866;The Sea of Monsters (Percy Jackson and the Olympians, #2);Rick Riordan;eng;4.23
152;446528056;Dear John;Nicholas Sparks;en-US;4.01
153;1416914293;City of Ashes (The Mortal Instruments, #2);Cassandra Clare;eng;4.21
154;743477103;Macbeth;William Shakespeare;eng;3.88
155;618346260;The Two Towers (The Lord of the Rings, #2);J.R.R. Tolkien;en-US;4.42
156;031232118X;Something Borrowed (Darcy & Rachel, #1);Emily Giffin;eng;3.83
157;394800168;Green Eggs and Ham;Dr. Seuss, לאה נאור;en-US;4.29
158;142403881;Charlie and the Chocolate Factory (Charlie Bucket, #1);Roald Dahl, Quentin Blake;eng;4.1
159;1423101464;The Battle of the Labyrinth (Percy Jackson and the Olympians, #4);Rick Riordan;eng;4.39
160;192833596;Great Expectations;Charles Dickens;eng;3.75
161;345339738;The Return of the King (The Lord of the Rings, #3);J.R.R. Tolkien;en-US;4.51
162;;The Stranger;Albert Camus, Matthew    Ward;eng;3.96
163;142311339X;The Lost Hero (The Heroes of Olympus, #1);Rick Riordan;eng;4.35
164;1250012570;Eleanor & Park;Rainbow Rowell;eng;4.11
165;055358202X;A Feast for Crows (A Song of Ice and Fire, #4);George R.R. Martin;en-US;4.1
166;525423648;Matched (Matched, #1);Ally Condie;eng;3.68
167;747263744;American Gods (American Gods, #1);Neil Gaiman;eng;4.11
168;385199570;The Stand;Stephen King, Bernie Wrightson;en-US;4.34
169;446547565;The Last Song;Nicholas Sparks;en-GB;4.14
170;552151696;Digital Fortress;Dan Brown;en-GB;3.6
171;141439580;Emma;Jane Austen, Fiona Stafford;eng;3.99
172;345803922;Anna Karenina;Leo Tolstoy, Louise Maude, Leo Tolstoj, Aylmer Maude;eng;4.02
173;393312836;A Clockwork Orange;Anthony Burgess;eng;3.98
174;964729237;The Shack;William Paul Young;eng;3.74
175;739380338;The Last Olympian (Percy Jackson and the Olympians, #5);Rick Riordan;eng;4.5
176;451169514;It;Stephen King;en-US;4.18
177;143058142;Crime and Punishment;Fyodor Dostoyevsky, David McDuff;eng;4.18
178;61148512;The Bell Jar;Sylvia Plath;en-US;3.98
179;7205236;Angela's Ashes (Frank McCourt, #1);Frank McCourt;eng;4.07
180;553208845;Siddhartha;Hermann Hesse, Hilda Rosner;eng;3.99
181;679745580;In Cold Blood;Truman Capote;eng;4.05
182;316042676;Beautiful Creatures (Caster Chronicles, #1);Kami Garcia, Margaret Stohl;eng;3.76
183;1416975861;Clockwork Angel (The Infernal Devices, #1);Cassandra Clare;eng;4.33
184;141301066;Matilda;Roald Dahl, Quentin Blake;eng;4.29
185;385534639;The Night Circus;Erin Morgenstern;eng;4.03
186;743227441;The Other Boleyn Girl (The Plantagenet and Tudor Novels, #9);Philippa Gregory;eng;4.04
187;689865384;Uglies (Uglies, #1);Scott Westerfeld;eng;3.86
188;;A Dance with Dragons (A Song of Ice and Fire, #5);George R.R. Martin;eng;4.31
189;618640150;The Lord of the Rings (The Lord of the Rings, #1-3);J.R.R. Tolkien;eng;4.47
190;307592731;Wild: From Lost to Found on the Pacific Crest Trail;Cheryl Strayed;eng;3.96
191;930289234;Watchmen;Alan Moore, Dave Gibbons, John Higgins;en-US;4.35
192;075640407X;The Name of the Wind (The Kingkiller Chronicle, #1);Patrick Rothfuss;eng;4.55
193;316017922;Outliers: The Story of Success;Malcolm Gladwell;en-US;4.11
194;142437247;Moby-Dick or, The Whale;Herman Melville, Andrew Delbanco, Tom Quirk;eng;3.46
195;385340990;The Guernsey Literary and Potato Peel Pie Society;Mary Ann Shaffer, Annie Barrows;eng;4.12
196;393327345;Fight Club;Chuck Palahniuk;eng;4.2
197;441008534;Dead Until Dark (Sookie Stackhouse, #1);Charlaine Harris;en-US;3.96
198;671727796;The Color Purple;Alice Walker;eng;4.17
199;739461192;Marley and Me: Life and Love With the World's Worst Dog;John Grogan;eng;4.12
200;312330871;And Then There Were None;Agatha Christie;eng;4.23
201;385504225;The Lost Symbol (Robert Langdon, #3);Dan Brown;eng;3.66
202;1416989412;Hush, Hush (Hush, Hush, #1);Becca Fitzpatrick;en-US;4.0
203;;Beautiful Disaster (Beautiful, #1);Jamie McGuire;eng;4.15
204;1561797464;A Christmas Carol;Charles Dickens;;4.02
205;345476875;Interview with the Vampire (The Vampire Chronicles, #1);Anne Rice;eng;3.97
206;62059939;The Selection (The Selection, #1);Kiera Cass;en-US;4.15
207;312362080;One for the Money (Stephanie Plum, #1);Janet Evanovich;en-US;4.03
208;1400052173;The Immortal Life of Henrietta Lacks;Rebecca Skloot;eng;4.04
209;99446782;The Silence of the Lambs  (Hannibal Lecter, #2);Thomas Harris;eng;4.14
210;159514174X;Vampire Academy (Vampire Academy, #1);Richelle Mead;en-US;4.14
211;316010669;Blink: The Power of Thinking Without Thinking;Malcolm Gladwell;en-US;3.89
212;038572179X;Atonement;Ian McEwan;eng;3.88
213;553213695;The Metamorphosis;Franz Kafka, Stanley Corngold;eng;3.78
214;141382899;The Titan's Curse (Percy Jackson and the Olympians, #3);Rick Riordan;eng;4.33
215;030788743X;Ready Player One;Ernest Cline;eng;4.31
216;1554681723;The Art of Racing in the Rain;Garth Stein;eng;4.19
217;739303406;The Devil in the White City: Murder, Magic, and Madness at the Fair That Changed America;Erik Larson, Tony Goldwyn;eng;3.98
218;425263908;Bared to You (Crossfire, #1);Sylvia Day;eng;4.19
219;66238501;The Chronicles of Narnia (Chronicles of Narnia, #1-7);C.S. Lewis, Pauline Baynes;eng;4.24
220;316043133;Twilight: The Complete Illustrated Movie Companion;Mark Cotta Vaz;en-US;4.23
221;1558743669;A Child Called "It" (Dave Pelzer #1);Dave Pelzer;eng;4.08
222;752864327;The Bourne Identity (Jason Bourne, #1);Robert Ludlum;eng;3.98
223;786817879;Artemis Fowl (Artemis Fowl, #1);Eoin Colfer;eng;3.82
224;385738935;Fallen (Fallen, #1);Lauren Kate;en-US;3.74
225;142000655;East of Eden;John Steinbeck;eng;4.35
226;307341569;Dark Places;Gillian Flynn;eng;3.92
227;385339089;The Client;John Grisham;eng;3.97
228;312291639;The Nanny Diaries (Nanny, #1);Emma McLaughlin, Nicola Kraus;eng;3.4
229;451527747;Alice's Adventures in Wonderland & Through the Looking-Glass;Lewis Carroll, John Tenniel, Martin Gardner;eng;4.06
230;192802631;Persuasion;Jane Austen, James Kinsley, Deidre Shauna Lynch;eng;4.13
231;312370830;Sarah's Key;Tatiana de Rosnay;eng;4.14
232;452284694;The Gunslinger (The Dark Tower, #1);Stephen King;en-US;3.99
233;140003468X;Love in the Time of Cholera;Gabriel García Márquez, Edith Grossman;eng;3.89
234;014131088X;Speak;Laurie Halse Anderson;eng;4.0
235;399159347;The Husband's Secret;Liane Moriarty;eng;3.92
236;385494785;Into Thin Air: A Personal Account of the Mount Everest Disaster;Jon Krakauer;en-US;4.11
237;1416524304;Carrie;Stephen King;;3.93
238;031242227X;Running with Scissors;Augusten Burroughs;en-US;3.7
239;307346609;World War Z: An Oral History of the Zombie War;Max Brooks;en-US;4.01
240;385537859;Inferno (Robert Langdon, #4);Dan Brown;eng;3.8
241;440227534;Number the Stars;Lois Lowry;eng;4.11
242;446692638;Along Came a Spider (Alex Cross, #1);James Patterson;eng;4.08
243;450417395;Misery;Stephen King;en-GB;4.11
244;307341542;Sharp Objects;Gillian Flynn;en-US;3.92
245;439366771;Bridge to Terabithia;Katherine Paterson;eng;3.98
246;312360266;Marked (House of Night, #1);P.C. Cast, Kristin Cast;en-US;3.79
247;743269519;The 7 Habits of Highly Effective People: Powerful Lessons in Personal Change;Stephen R. Covey;en-US;4.05
248;743477545;A Midsummer Night's Dream;William Shakespeare, Barbara A. Mowat, Paul Werstine, Catherine Belsey;eng;3.94
249;618711651;Extremely Loud and Incredibly Close;Jonathan Safran Foer;en-US;3.97
250;375869026;Wonder;R.J. Palacio;eng;4.43
251;039480001X;The Cat in the Hat;Dr. Seuss;eng;4.15
252;312641893;Cinder (The Lunar Chronicles, #1);Marissa Meyer;eng;4.15
253;316206849;The Cuckoo's Calling (Cormoran Strike, #1);Robert Galbraith, J.K. Rowling;en-US;3.83
254;545123267;Shiver (The Wolves of Mercy Falls, #1);Maggie Stiefvater;eng;3.78
255;452011876;Atlas Shrugged;Ayn Rand, Leonard Peikoff;eng;3.68
256;143038257;Three Cups of Tea: One Man's Mission to Promote Peace ... One School at a Time;Greg Mortenson, David Oliver Relin;en-US;3.64
257;517223627;Alice in Wonderland;Jane Carruth, Lewis Carroll, Rene Cloke;eng;4.03
258;143034901;The Shadow of the Wind (The Cemetery of Forgotten Books,  #1);Carlos Ruiz Zafón, Lucia Graves;eng;4.24
259;385738757;The Scorch Trials (Maze Runner, #2);James Dashner;eng;3.93
260;;How to Win Friends and Influence People;Dale Carnegie;eng;4.13
261;767900383;Under the Tuscan Sun;Frances Mayes;eng;3.72
262;399167064;Big Little Lies;Liane Moriarty;eng;4.2
263;590920685;Ella Enchanted;Gail Carson Levine;eng;3.97
264;743297334;The Sun Also Rises;Ernest Hemingway;en-US;3.83
265;61120073;A Tree Grows in Brooklyn;Betty  Smith;eng;4.24
266;446677388;Kiss the Girls (Alex Cross, #2);James Patterson;eng;3.93
267;312577222;The Nightingale;Kristin Hannah;eng;4.54
268;1400078776;Never Let Me Go;Kazuo Ishiguro;eng;3.8
269;786890754;P.S. I Love You;Cecelia Ahern;en-US;4.01
270;1844080382;Rebecca;Daphne du Maurier, Sally Beauman;en-US;4.2
271;156030306;Flowers for Algernon;Daniel Keyes;en-US;4.07
272;552995878;Like Water for Chocolate;Laura Esquivel, Thomas  Christensen, Carol Christensen;en-US;3.94
273;812968069;Snow Flower and the Secret Fan;Lisa See;eng;4.05
274;451205766;The Godfather;Mario Puzo, Robert Thompson, Peter Bart;eng;4.36
275;525476881;An Abundance of Katherines;John Green;eng;3.63
276;553803719;Foundation (Foundation #1);Isaac Asimov;eng;4.13
277;62255657;The Ocean at the End of the Lane;Neil Gaiman;eng;3.99
278;60513063;A Light in the Attic;Shel Silverstein;eng;4.34
279;751565350;Harry Potter and the Cursed Child - Parts One and Two (Harry Potter, #8);John Tiffany, Jack Thorne, J.K. Rowling;eng;3.75
280;61726834;Delirium (Delirium, #1);Lauren Oliver;eng;3.99
281;385339704;The Pelican Brief;John Grisham;eng;3.95
282;61139378;Coraline;Neil Gaiman;eng;4.03
283;60853980;Good Omens: The Nice and Accurate Prophecies of Agnes Nutter, Witch;Terry Pratchett, Neil Gaiman;en-US;4.25
284;140042598;On the Road;Jack Kerouac;eng;3.64
285;1476729085;The Rosie Project (Don Tillman, #1);Graeme Simsion;eng;4.01
286;446579939;The Lucky One;Nicholas Sparks;en-US;4.1
287;451191153;The Fountainhead;Ayn Rand, Leonard Peikoff;eng;3.85
288;425172902;The Hunt for Red October (Jack Ryan Universe, #4);Tom Clancy;;4.01
289;038039586X;Watership Down (Watership Down, #1);Richard Adams;eng;4.05
290;307886263;Is Everyone Hanging Out Without Me? (And Other Concerns);Mindy Kaling;eng;3.84
291;375414495;Cutting for Stone;Abraham Verghese;eng;4.28
292;006112527X;The Voyage of the Dawn Treader (Chronicles of Narnia, #3);C.S. Lewis, Pauline Baynes;eng;4.08
293;753453800;Treasure Island;Robert Louis Stevenson;eng;3.82
294;1423140591;The Son of Neptune (The Heroes of Olympus, #2);Rick Riordan;eng;4.44
295;1451627289;11/22/63;Stephen King;eng;4.29
296;241003008;The Very Hungry Caterpillar Board Book;Eric Carle;eng;4.29
297;140285601;Cat's Cradle;Kurt Vonnegut Jr.;eng;4.18
298;451528557;The Time Machine;H.G. Wells, Greg Bear, Carlo Pagetti;eng;3.87
299;849946158;Heaven is for Real: A Little Boy's Astounding Story of His Trip to Heaven and Back;Todd Burpo, Lynn Vincent;eng;4.01
300;385751060;The Boy in the Striped Pajamas;John Boyne;eng;4.1
301;1892295490;Heart of Darkness;Joseph Conrad;eng;3.42
302;044654759X;Safe Haven;Nicholas Sparks;eng;4.19
303;1582701709;The Secret (The Secret, #1);Rhonda Byrne;eng;3.62
304;60987561;I Know This Much Is True;Wally Lamb;eng;4.17
305;1416524347;Pet Sematary;Stephen King;eng;3.91
306;671021001;She's Come Undone;Wally Lamb;en-US;3.84
307;756404738;The Wise Man's Fear (The Kingkiller Chronicle, #2);Patrick Rothfuss;eng;4.57
308;440241901;Can You Keep a Secret?;Sophie Kinsella;en-US;3.83
309;1442403543;City of Fallen Angels (The Mortal Instruments, #4);Cassandra Clare;en-US;4.16
310;743418174;Good in Bed (Cannie Shapiro, #1);Jennifer Weiner;en-US;3.7
311;380018179;The Thorn Birds;Colleen McCullough;eng;4.22
312;60530928;The Graveyard Book;Neil Gaiman, Dave McKean;en-US;4.12
313;1451681739;The Light Between Oceans;M.L. Stedman;eng;4.0
314;439709105;Inkheart (Inkworld, #1);Cornelia Funke, Anthea Bell;en-US;3.86
315;91883768;Who Moved My Cheese?;Spencer Johnson, Kenneth H. Blanchard;eng;3.74
316;307279464;A Walk in the Woods;Bill Bryson;eng;4.05
317;553279378;I Know Why the Caged Bird Sings;Maya Angelou;en-US;4.19
318;61950726;Orphan Train;Christina Baker Kline;eng;4.14
319;1442416866;City of Lost Souls (The Mortal Instruments, #5);Cassandra Clare;eng;4.3
320;316204277;Where'd You Go, Bernadette;Maria Semple;eng;3.9
321;375806814;Where the Red Fern Grows;Wilson Rawls;;4.04
322;60557818;Neverwhere;Neil Gaiman;eng;4.18
323;571224385;The Unbearable Lightness of Being;Milan Kundera, Michael Henry Heim;eng;4.08
324;;Fangirl;Rainbow Rowell;eng;4.12
325;552135399;A Prayer for Owen Meany;John Irving;eng;4.22
326;316182540;White Oleander;Janet Fitch;eng;3.93
327;039925675X;Legend (Legend, #1);Marie Lu;eng;4.19
328;743496728;Nineteen Minutes;Jodi Picoult;eng;4.1
329;1401323251;The Last Lecture;Randy Pausch, Jeffrey Zaslow;eng;4.25
330;812511816;The Eye of the World (Wheel of Time, #1);Robert Jordan;eng;4.18
331;61150142;The Pact;Jodi Picoult;en-US;4.0
332;60764902;The Magician's Nephew (Chronicles of Narnia, #6);C.S. Lewis;eng;4.01
333;595440096;Still Alice;Lisa Genova;eng;4.3
334;425263916;Reflected in You (Crossfire, #2);Sylvia Day;eng;4.33
335;375814248;James and the Giant Peach;Roald Dahl, Quentin Blake;eng;3.99
336;446696617;1st to Die (Women's Murder Club, #1);James Patterson;en-US;4.05
337;345453743;The Ultimate Hitchhiker's Guide to the Galaxy;Douglas Adams;eng;4.37
338;340896965;One Day;David Nicholls;eng;3.77
339;60775858;Goodnight Moon;Margaret Wise Brown, Clement Hurd;en-US;4.27
340;61969559;I Am Number Four (Lorien Legacies, #1);Pittacus Lore;en-US;3.94
341;140275363;The Iliad;Homer, Robert Fagles, Frédéric Mugler, Bernard Knox;eng;3.83
342;316228532;The Casual Vacancy;J.K. Rowling;eng;3.28
343;385339690;The Runaway Jury;John Grisham;eng;3.96
344;316777730;Naked;David Sedaris;en-US;4.08
345;375840400;Eldest (The Inheritance Cycle, #2);Christopher Paolini;en-US;3.96
346;140621679;The Wonderful Wizard of Oz (Oz, #1);L. Frank Baum, W.W. Denslow;eng;3.98
347;000720230X;Prince Caspian (Chronicles of Narnia, #2);C.S. Lewis;eng;3.96
348;;We Were Liars;E. Lockhart;eng;3.85
349;450031063;'Salem's Lot;Stephen King;en-GB;3.99
350;679785892;Fear and Loathing in Las Vegas;Hunter S. Thompson, Ralph Steadman;eng;4.08
351;1416975888;Clockwork Prince (The Infernal Devices, #2);Cassandra Clare;eng;4.46
352;62268341;Yes Please;Amy Poehler;eng;3.81
353;743477553;Othello;William Shakespeare;eng;3.88
354;1400033411;Beloved;Toni Morrison;eng;3.77
355;015206396X;Graceling (Graceling Realm, #1);Kristin Cashore;en-CA;4.1
356;439206472;The Bad Beginning (A Series of Unfortunate Events, #1);Lemony Snicket, Brett Helquist;eng;3.89
357;449213943;All Quiet on the Western Front;Erich Maria Remarque, A.W. Wheen;en-US;3.92
358;679805273;Oh, The Places You'll Go!;Dr. Seuss;en-US;4.34
359;159463176X;And the Mountains Echoed;Khaled Hosseini;eng;4.03
360;345404475;Do Androids Dream of Electric Sheep?;Philip K. Dick, Roger Zelazny;eng;4.08
361;141439742;Oliver Twist;Charles Dickens, George Cruikshank, Philip Horne;eng;3.85
362;60652896;The Screwtape Letters;C.S. Lewis;eng;4.21
