id;isbn;title;authors;language;avg-rating
4763;375727019;The Elementary Particles;Michel Houellebecq, Frank Wynne;eng;3.78
4764;;Beauty from Surrender (Beauty, #2);Georgia Cates;eng;4.13
4765;785114777;Dracula (Marvel Illustrated);Roy Thomas, Dick Giordano, Mark D. Beazley, Bram Stoker;;3.93
4766;439014573;The Adventures of Captain Underpants (Captain Underpants, #1);Dav Pilkey;eng;3.84
4767;547564651;How Children Succeed: Grit, Curiosity, and the Hidden Power of Character;Paul Tough;eng;3.91
4768;446677949;The Fountains of Paradise;Arthur C. Clarke;eng;3.96
4769;670038342;The Bastard of Istanbul;Elif Shafak;eng;3.79
4770;307931900;Two Boys Kissing;David Levithan;eng;4.11
4771;61231401;The Doomsday Key (Sigma Force, #6);James Rollins;en-US;4.16
4772;1400043875;The Ruins;Scott B. Smith;en-US;3.5
4773;60525657;A Dangerous Path (Warriors, #5);Erin Hunter;eng;4.42
4774;449000753;Dances with Wolves (Dances with Wolves, #1);Michael Blake;eng;4.19
4775;375814698;Bloodhound (Beka Cooper, #2);Tamora Pierce;eng;4.26
4776;160751351X;The Night Angel Trilogy (Night Angel, #1-3);Brent Weeks;eng;4.42
4777;675093244;A Rose for Emily and Other Stories;William Faulkner;eng;4.06
4778;;The Holy Bible: English Standard Version;Anonymous;eng;4.66
4779;446400157;A Morbid Taste for Bones (Chronicles of Brother Cadfael, #1);Ellis Peters;en-US;3.99
4780;019283410X;The Lives of the Artists;Giorgio Vasari, Julia Conway Bondanella, Peter Bondanella;eng;3.78
4781;312934335;Unleash the Night (Dark Hunter, #8: Were-Hunter, #2);Sherrilyn Kenyon;en-US;4.34
4782;747594155;Syren (Septimus Heap, #5);Angie Sage;eng;4.1
4783;3453532988;Metro 2033 (METRO, #1);Dmitry Glukhovsky, M. David Drevs;ger;3.98
4784;1741753597;The Slap;Christos Tsiolkas;eng;3.16
4785;64301389;The Art Spirit: Notes, Articles, Fragments of Letters and Talks to Students, Bearing on the Concept and Technique of Picture Making, the Study of Art (Icon Editions);Robert Henri, Forbes Watson, Margery A. Ryerson;eng;3.87
4786;1611099692;Brilliance (Brilliance Saga, #1);Marcus Sakey;eng;3.95
4787;;Life and Other Near-Death Experiences;Camille Pagán;en-GB;3.82
4788;571219357;The Fortress of Solitude;Jonathan Lethem;eng;3.87
4789;553804820;The Darkest Evening of the Year;Dean Koontz;eng;3.71
4790;374104107;Authority (Southern Reach, #2);Jeff VanderMeer;eng;3.55
4791;689859406;The Wrath of Mulgarath (The Spiderwick Chronicles, #5);Holly Black, Tony DiTerlizzi;en-US;3.92
4792;61966908;The Scrapbook of Frankie Pratt;Caroline Preston;eng;3.72
4793;385498802;Bee Season;Myla Goldberg;eng;3.55
4794;60567112;Indelible (Grant County, #4);Karin Slaughter;eng;4.19
4795;425098648;Night Chills;Dean Koontz;en-US;3.86
4796;517543052;Be Here Now;Ram Dass, Richard Alpert;en-US;4.27
4797;425204200;Trace (Kay Scarpetta, #13);Patricia Cornwell;eng;3.76
4798;440243904;Genghis: Birth of an Empire (Conqueror, #1);Conn Iggulden;en-US;4.34
4799;345373529;The Ruby Knight (The Elenium, #2);David Eddings;eng;3.96
4800;60177241;The Thief of Always;Clive Barker;eng;4.18
4801;553589385;Kiss of Crimson (Midnight Breed, #2);Lara Adrian;en-US;4.17
4802;345497627;The Keepsake (Rizzoli & Isles, #7);Tess Gerritsen;en-US;4.09
4803;316219266;The Everything Store: Jeff Bezos and the Age of Amazon;Brad Stone;eng;4.06
4804;;The Air He Breathes (Elements, #1);Brittainy C. Cherry;;4.2
4805;1416580948;Kiss of a Demon King (Immortals After Dark #7);Kresley Cole;eng;4.35
4806;553813153;The Bonehunters (Malazan Book of the Fallen, #6);Steven Erikson;eng;4.42
4807;988695103;Forever My Girl (The Beaumont Series, #1);Heidi McLaughlin;eng;4.04
4808;1477825940;The Glass Magician (The Paper Magician Trilogy, #2);Charlie N. Holmberg;;3.87
4809;9380658674;Chanakya's Chant;Ashwin Sanghi;eng;3.68
4810;312265050;The Naked and the Dead;Norman Mailer;eng;3.94
4811;019516895X;Battle Cry of Freedom;James M. McPherson;eng;4.32
4812;307162346;The Little Mermaid;Michael Teitelbaum, Sue DiCicco;;4.36
4813;044661761X;Lifeguard;James Patterson, Andrew Gross;;3.76
4814;038573882X;Because of Mr. Terupt;Rob Buyea;eng;4.34
4815;330398059;Blubber;Judy Blume;en-GB;3.78
4816;61783196;One Grave at a Time (Night Huntress, #6);Jeaniene Frost;eng;4.25
4817;1937053164;Apollyon (Covenant, #4);Jennifer L. Armentrout;eng;4.4
4818;7288387;I Heart New York (I Heart, #1);Lindsey Kelk;en-US;3.84
4819;545040523;Airhead (Airhead, #1);Meg Cabot;eng;3.77
4820;452281458;Beauty's Release (Sleeping Beauty, #3);A.N. Roquelaure, Anne Rice;eng;3.71
4821;152063846;Jessica's Guide to Dating on the Dark Side (Jessica, #1);Beth Fantaskey;en-US;3.85
4822;871401525;Complete Poems, 1904-1962;E.E. Cummings;eng;4.35
4823;609610570;Execution: The Discipline of Getting Things Done;Larry Bossidy, Ram Charan, Charles Burck;en-US;3.83
4824;393240231;Smoke Gets in Your Eyes: And Other Lessons from the Crematory;Caitlin Doughty;eng;4.04
4825;399156585;The Rembrandt Affair (Gabriel Allon, #10);Daniel Silva;eng;4.26
4826;;The Call of Cthulhu;H.P. Lovecraft;eng;4.05
4827;61147974;20th Century Ghosts;Joe Hill, Christopher Golden;en-US;3.95
4828;375724508;Ghostwritten;David Mitchell;eng;4.06
4829;;The One That Got Away;Simon Wood;eng;3.77
4830;159514322X;The Ruby Circle (Bloodlines, #6);Richelle Mead;eng;4.22
4831;316114278;Where the Mountain Meets the Moon;Grace Lin;eng;4.24
4832;087923573X;Swallows and Amazons (Swallows and Amazons, #1);Arthur Ransome;eng;3.98
4833;1402245793;Rock Hard (Sinners on Tour, #2);Olivia Cunning;eng;4.11
4834;;How to Build a Girl;Caitlin Moran;eng;3.69
4835;9793062924;Sang Pemimpi (Tetralogi Laskar Pelangi, #2);Andrea Hirata;ind;4.09
4836;743250621;The Know-It-All: One Man's Humble Quest to Become the Smartest Person in the World;A.J. Jacobs;eng;3.77
4837;525953078;Touch & Go (Tessa Leoni, #2);Lisa Gardner;eng;4.05
4838;1400047463;The Double Bind;Chris Bohjalian;eng;3.62
4839;312642695;Summer Rental;Mary Kay Andrews;en-US;3.78
4840;7563035;The Ice Twins;S.K. Tremayne;eng;3.68
4841;1455549002;The Edge of Always (The Edge of Never, #2);J.A. Redmerski;eng;4.02
4842;452284449;The Virgin Blue;Tracy Chevalier;eng;3.65
4843;1400069807;Salt Sugar Fat: How the Food Giants Hooked Us;Michael Moss;eng;3.98
4844;152020683;Half Magic (Tales of Magic, #1);Edward Eager, N.M. Bodecker;en-US;3.94
4845;1594744548;Dawn of the Dreadfuls (Pride and Prejudice and Zombies, #0.5);Steve Hockensmith, Jane Austen, Patrick Arrasmith;eng;3.47
4846;553807242;Live to Tell (Detective D.D. Warren, #4);Lisa Gardner;eng;4.18
4847;688128971;Lilly's Purple Plastic Purse;Kevin Henkes;;4.2
4848;140143505;84, Charing Cross Road;Helene Hanff;eng;4.19
4849;;Father Mine (Black Dagger Brotherhood, #6.5);J.R. Ward;eng;4.51
4850;553351397;Peace Is Every Step: The Path of Mindfulness in Everyday Life;Thich Nhat Hanh, Arnold Kotler, Dalai Lama XIV;eng;4.34
4851;;Electric Daisy, Vol. 1 (Dengeki Daisy, #1);Kyousuke Motomi;ind;4.3
4852;1501117203;Scrappy Little Nobody;Anna Kendrick;eng;3.91
4853;;The Einstein Prophecy;Robert Masello;en-US;3.58
4854;385608020;Started Early, Took My Dog (Jackson Brodie, #4);Kate Atkinson;eng;3.89
4855;930289447;Batman: A Death in the Family;Jim Starlin, Jim Aparo, Mike DeCarlo;eng;4.05
4856;1400069599;TransAtlantic;Colum McCann;eng;3.81
4857;61783161;Eternal Kiss of Darkness (Night Huntress World, #2);Jeaniene Frost;en-GB;4.21
4858;743571355;The Spellman Files (The Spellmans, #1);Lisa Lutz;eng;3.88
4859;425165582;Books of Blood: Volumes One to Three (Books of Blood #1-3);Clive Barker;eng;4.16
4860;60763892;The Judas Strain (Sigma Force, #4);James Rollins;eng;4.15
4861;785263713;Searching for God Knows What;Donald Miller;en-US;3.92
4862;60256710;The Missing Piece;Shel Silverstein;;4.27
4863;61006629;Fatherland;Robert   Harris;eng;3.96
4864;525951571;Freedom™ (Daemon, #2);Daniel Suarez;en-US;4.27
4865;60088877;The Bridge of San Luis Rey;Thornton Wilder;en-US;3.8
4866;;White Nights;Fyodor Dostoyevsky;eng;4.05
4867;425227723;Skin Trade (Anita Blake, Vampire Hunter #17);Laurell K. Hamilton;en-US;3.9
4868;875793266;Jesus the Christ;James E. Talmage;;4.63
4869;1570820872;Disney's the Lion King;Don Ferguson;en-US;4.49
4870;141439866;Shirley;Charlotte Brontë, Lucasta Miller, collaborative, Jessica Cox;;3.71
4871;515116750;Born in Ice (Born In Trilogy, #2);Nora Roberts;en-US;4.13
4872;1842431021;Villa Incognito;Tom Robbins;;3.65
4873;374260508;The Sellout;Paul Beatty;eng;3.8
4874;1401202225;Fables, Vol. 4: March of the Wooden Soldiers;Bill Willingham, Mark Buckingham, Craig Hamilton, Steve Leialoha, P. Craig Russell;eng;4.29
4875;804192979;Night School;Lee Child, Dick Hill;eng;3.96
4876;345515501;The Silent Girl (Rizzoli & Isles, #9);Tess Gerritsen;en-US;4.13
4877;7175191;Horton Hatches the Egg;Dr. Seuss;eng;4.14
4878;;A Shade of Blood (A Shade of Vampire, #2);Bella Forrest;eng;4.01
4879;62248472;Beyond Belief: My Secret Life Inside Scientology and My Harrowing Escape;Jenna Miscavige Hill, Lisa Pulitzer;eng;3.72
4880;865163480;Apology;Plato, James J. Helm;eng;4.15
4881;1563893274;Preacher, Volume 3: Proud Americans;Garth Ennis, Steve Dillon, Penn Jillette;eng;4.27
4882;307595110;The Wolf Gift (The Wolf Gift Chronicles, #1);Anne Rice;eng;3.52
4883;307960307;The Little Red Hen (Little Golden Book);Diane Muldrow, J.P. Miller;;4.2
4884;1455501476;Lethal;Sandra Brown;;4.04
4885;316017442;The Terror;Dan Simmons;eng;4.0
4886;670447161;Madeline's Rescue;Ludwig Bemelmans;eng;4.24
4887;61733636;Game Change: Obama and the Clintons, McCain and Palin, and the Race of a Lifetime;John Heilemann, Mark Halperin;;4.1
4888;067172942X;Garden of Shadows (Dollanganger, #5);V.C. Andrews;eng;3.88
4889;61957895;A Perfect Blood (The Hollows, #10);Kim Harrison;en-US;4.38
4890;310240018;Joni: An Unforgettable Story;Joni Eareckson Tada, Joe Musser;en-US;4.23
4891;786932171;War of the Twins (Dragonlance: Legends, #2);Margaret Weis, Tracy Hickman;eng;4.11
4892;031603617X;Cross Fire (Alex Cross, #17);James Patterson;eng;4.04
4893;142000159;Brunelleschi's Dome: How a Renaissance Genius Reinvented Architecture;Ross King;en-US;3.84
4894;1577312295;Creative Visualization: Use the Power of Your Imagination to Create What You Want in Your Life;Shakti Gawain;eng;4.13
4895;60584025;Metro Girl (Alex Barnaby, #1);Janet Evanovich;eng;3.6
4896;;Never Never: Part Three (Never Never, #3);Colleen Hoover, Tarryn Fisher;en-GB;3.48
4897;312360819;Second Grave on the Left (Charley Davidson, #2);Darynda Jones;en-US;4.29
4898;155652532X;Katherine;Anya Seton, Philippa Gregory;eng;4.18
4899;141020520;A Short History of Tractors in Ukrainian;Marina Lewycka;en-US;3.37
4900;62225464;Where They Found Her;Kimberly McCreight;eng;3.83
4901;553590162;Industrial Magic (Women of the Otherworld, #4);Kelley Armstrong;en-US;4.12
4902;2070364232;Le Petit Nicolas (Le petit Nicolas, #1);René Goscinny, Jean-Jacques Sempé;fre;4.13
4903;;The Atlantis Plague (The Origin Mystery, #2);A.G. Riddle;eng;3.88
4904;034547581X;We Were Soldiers Once... and Young: Ia Drang - The Battle that Changed the War in Vietnam;Harold G. Moore, Joseph L. Galloway;eng;4.29
4905;451215710;Whiteout;Ken Follett;en-US;3.54
4906;345349571;A Distant Mirror:  The Calamitous 14th Century;Barbara W. Tuchman;eng;4.11
4907;142407577;Heat;Mike Lupica;en-US;3.97
4908;60554738;The Game: Penetrating the Secret Society of Pickup Artists;Neil Strauss;en-US;3.73
4909;330348779;N is for Noose (Kinsey Millhone, #14);Sue Grafton;eng;3.97
4910;749941995;Just Like Heaven (Smythe-Smith Quartet #1);Julia Quinn;en-GB;3.93
4911;1423119509;Percy Jackson and the Olympians Boxed Set (Percy Jackson and the Olympians, #1-5);Rick Riordan, Tk;;4.57
4912;525952764;Catch Me (Detective D.D. Warren, #6);Lisa Gardner;eng;4.17
4913;778321606;The Shop on Blossom Street (Blossom Street, #1);Debbie Macomber;eng;4.04
4914;1560768800;Starless Night (Forgotten Realms: Legacy of the Drow, #2: Legend of Drizzt, #8);R.A. Salvatore;en-GB;4.12
4915;446616621;Night Fall (John Corey, #3);Nelson DeMille;eng;4.07
4916;316000957;Trials of Death (Cirque Du Freak, #5);Darren Shan;;4.25
4917;446539813;The Bourne Objective (Jason Bourne, #8);Eric Van Lustbader, Robert Ludlum;eng;4.07
4918;;The Score (Off-Campus, #3);Elle Kennedy;eng;4.27
4919;310247535;Even Now (Lost Love, #1);Karen Kingsbury;en-US;4.26
4920;316059862;Testimony;Anita Shreve;en-US;3.54
4921;1937007588;Magic Rises (Kate Daniels, #6);Ilona Andrews;eng;4.49
4922;345524616;Whispers Under Ground (Peter Grant, #3);Ben Aaronovitch;eng;4.16
4923;031621129X;Unlucky 13 (Women’s Murder Club, #13);James Patterson, Maxine Paetro;eng;3.94
4924;446604089;The Best Laid Plans;Sidney Sheldon;eng;3.66
4925;61433012;Nation;Terry Pratchett;en-US;4.05
4926;61259349;Secrets of a Summer Night (Wallflowers, #1);Lisa Kleypas;eng;4.05
4927;1595540342;Red: The Heroic Rescue (The Circle, #2);Ted Dekker;eng;4.3
4928;312655452;A Trick of the Light (Chief Inspector Armand Gamache, #7);Louise Penny;eng;4.29
4929;;White Hot Kiss (The Dark Elements, #1);Jennifer L. Armentrout;eng;4.28
4930;4757518080;Pandora Hearts 1巻;Jun Mochizuki, 望月淳;jpn;4.2
4931;345329457;At the Mountains of Madness and Other Tales of Terror;H.P. Lovecraft;en-US;4.25
4932;60596988;Lit;Mary Karr;eng;3.88
4933;893662135;Dragonsdawn (Pern, #9);Anne McCaffrey;;4.17
4934;399252649;Mockingbird;Kathryn Erskine;eng;4.18
4935;;28 حرف;أحمد حلمي;ara;3.1
4936;1590521358;I Kissed Dating Goodbye;Joshua Harris;;3.61
4937;808553038;The Egypt Game (Game, #1);Zilpha Keatley Snyder;eng;3.81
4938;375703055;Ellen Foster;Kaye Gibbons;eng;3.75
4939;805210555;The Complete Stories;Franz Kafka, Nahum N. Glatzer, John Updike, Willa Muir, Edwin Muir, Tania Stern, James Stern, Ernst Kaiser, Eithne Wilkins;eng;4.34
4940;156924264X;Veganomicon: The Ultimate Vegan Cookbook;Isa Chandra Moskowitz, Terry Hope Romero;;3.98
4941;786933887;Test of the Twins (Dragonlance: Legends, #3);Margaret Weis, Tracy Hickman;eng;4.16
4942;374530637;Wise Blood;Flannery O'Connor;en-US;3.88
4943;9753638027;Kürk Mantolu Madonna;Sabahattin Ali;tur;4.49
4944;345379624;Running with the Demon (Word & Void, #1);Terry Brooks;eng;3.95
4945;1557488150;In His Steps;Charles M. Sheldon;;4.15
4946;1439136823;Lothaire (Immortals After Dark #12);Kresley Cole;eng;4.43
4947;1423102991;Knuffle Bunny Too: A Case of Mistaken Identity (Knuffle Bunny, #2);Mo Willems;en-US;4.28
4948;446195979;The Whole Truth (A. Shaw, #1);David Baldacci;eng;4.0
4949;61628018;Stolen Innocence: My Story of Growing Up in a Polygamous Sect, Becoming a Teenage Bride, and Breaking Free of Warren Jeffs;Elissa Wall, Lisa Pulitzer;;3.89
4950;039925692X;Out of the Easy;Ruta Sepetys;eng;4.05
4951;1401216226;Batman: The Man Who Laughs;Ed Brubaker, Doug Mahnke, Patrick Zircher, Aaron Sowd, Steve Bird;eng;4.09
4952;60744510;Midnight (Warriors: The New Prophecy, #1);Erin Hunter;eng;4.26
4953;62273205;The Hard Thing About Hard Things: Building a Business When There Are No Easy Answers;Ben Horowitz;eng;4.2
4954;1461052149;The Fallen Star (Fallen Star, #1);Jessica Sorensen;;3.91
4955;345348664;The Illearth War (The Chronicles of Thomas Covenant the Unbeliever, #2);Stephen R. Donaldson;;3.99
4956;340936150;My Booky Wook;Russell Brand;en-GB;3.42
4957;425259862;Shadow Spell (The Cousins O'Dwyer Trilogy, #2);Nora Roberts;en-US;4.0
4958;1592406521;Just My Type: A Book About Fonts;Simon Garfield;en-US;3.79
4959;399155481;Promises in Death (In Death, #28);J.D. Robb;eng;4.4
4960;876853629;Love Is a Dog from Hell;Charles Bukowski;eng;4.16
4961;316229296;The Fifth Season (The Broken Earth, #1);N.K. Jemisin;eng;4.31
4962;1846247195;The Zombie Room;R.D. Ronald;eng;3.61
4963;552150215;The Analyst;John Katzenbach;eng;4.12
4964;670019631;Shades of Grey;Jasper Fforde;eng;4.14
4965;140389660;That Was Then, This Is Now;S.E. Hinton;en-US;3.89
4966;307582396;The Mysterious Benedict Society and the Prisoner's Dilemma (The Mysterious Benedict Society, #3);Trenton Lee Stewart, Del Roy;;4.28
4967;61579033;The Family Fang;Kevin    Wilson;en-US;3.6
4968;60744871;The Pursuit of Happyness;Chris Gardner;;4.17
4969;;Min kamp 1 (Min kamp #1);Karl Ove Knausgård;nor;4.08
4970;385342322;A Red Herring Without Mustard (Flavia de Luce, #3);Alan Bradley;eng;4.07
4971;684804484;No Ordinary Time: Franklin and Eleanor Roosevelt: The Home Front in World War II;Doris Kearns Goodwin;eng;4.2
4972;375701907;Straight Man;Richard Russo;eng;4.02
4973;375701966;The Moviegoer;Walker Percy;en-CA;3.7
4974;413774031;The Cherry Orchard;Anton Chekhov, Tom    Murphy;eng;3.68
4975;545052394;11 Birthdays (Willow Falls, #1);Wendy Mass;eng;4.18
4976;026110215X;Unfinished Tales of Númenor and Middle-Earth;J.R.R. Tolkien, Christopher Tolkien;;3.93
4977;385521227;Sisterhood Everlasting (Sisterhood, #5);Ann Brashares;eng;3.9
4978;451452011;Infinity Welcomes Careful Drivers (Red Dwarf #1);Grant Naylor;eng;4.03
4979;60735430;Coyote Blue;Christopher Moore;en-US;3.75
4980;;فوضى الحواس;أحلام مستغانمي, Ahlam Mosteghanemi;ara;3.83
4981;160096527X;Orthodoxy;G.K. Chesterton;eng;4.23
4982;60542098;Fancy Nancy;Jane O'Connor, Robin Preiss Glasser;;4.15
4983;99478420;The Heart of the Matter;Graham Greene;eng;3.98
4984;141971189X;The Long Haul (Diary of a Wimpy Kid, #9);Jeff Kinney;eng;4.33
4985;152046917;Talking to Dragons (Enchanted Forest Chronicles, #4);Patricia C. Wrede, Peter de Sève;en-US;4.19
4986;316018708;Sail;James Patterson, Howard Roughan;eng;3.8
4987;1408859645;The Sleeper and the Spindle;Neil Gaiman, Chris Riddell;eng;3.9
4988;045141991X;A Fall of Marigolds;Susan Meissner;;4.04
4989;452281431;Beauty's Punishment (Sleeping Beauty, #2);A.N. Roquelaure, Anne Rice;en-US;3.62
4990;1414310560;The Negotiator (O'Malley, #1);Dee Henderson;eng;4.32
4991;143417231;Can Love Happen Twice?;Ravinder Singh;eng;3.31
4992;60548924;A Lion Among Men (The Wicked Years, #3);Gregory Maguire, Douglas Smith;en-US;3.29
4993;380720868;Shadow of a Dark Queen (The Serpentwar Saga, #1);Raymond E. Feist;eng;4.02
4994;802136680;This Boy's Life;Tobias Wolff;eng;3.98
4995;312382855;Patient Zero (Joe Ledger, #1);Jonathan Maberry;en-US;3.98
4996;679728899;Death Comes for the Archbishop;Willa Cather;eng;3.88
4997;1841497967;Fair Game (Alpha & Omega, #3);Patricia Briggs;en-US;4.34
4998;1423194551;The Son of Sobek (Percy Jackson & Kane Chronicles Crossover, #1);Rick Riordan;eng;4.26
4999;1854596373;Tartuffe;Molière, Martin Sorrell;eng;3.66
5000;446401056;Passion Unleashed (Demonica #3);Larissa Ione;eng;4.32
5001;1421514818;High School Debut, Vol. 01 (High School Debut, #1);Kazune Kawahara;en-GB;4.11
5002;9953716889;في ديسمبر تنتهي كل الأحلام;أثير عبدالله النشمي;ara;3.33
5003;030711838X;Just for You (Little Critter);Mercer Mayer;eng;4.25
5004;60002492;Amazonia;James Rollins;eng;4.11
5005;380810336;Feeling Good: The New Mood Therapy;David D. Burns;en-US;3.95
5006;515141399;Blue Smoke;Nora Roberts;eng;3.97
5007;425210278;Predator (Kay Scarpetta, #14);Patricia Cornwell;en-US;3.67
5008;894864025;Codependent No More: How to Stop Controlling Others and Start Caring for Yourself;Melody Beattie;;4.13
5009;1933480092;Oblomov;Ivan Goncharov, Stephen Pearl, Galya Diment;eng;4.0
5010;743426800;Inca Gold (Dirk Pitt, #12);Clive Cussler;eng;3.96
5011;1400069629;Delicious!;Ruth Reichl;eng;3.75
5012;446504122;NurtureShock: New Thinking About Children;Po Bronson, Ashley Merryman;en-US;4.04
5013;044657967X;Wild Fire (John Corey, #4);Nelson DeMille;en-US;3.99
5014;743497295;Two Little Girls in Blue;Mary Higgins Clark;en-US;3.85
5015;055327211X;Daughter of the Empire (The Empire Trilogy, #1);Raymond E. Feist, Janny Wurts;eng;4.24
5016;689872372;Everlost (Skinjacker, #1);Neal Shusterman;eng;3.94
5017;1439136807;Dreams of a Dark Warrior (Immortals After Dark #11);Kresley Cole;en-US;4.39
5018;142428698;Theodore Boone: Kid Lawyer (Theodore Boone, #1);John Grisham, Richard Thomas;eng;3.72
5019;224063979;Jimmy Corrigan, the Smartest Kid on Earth;Chris Ware;;4.1
5020;142300705;A Year Down Yonder (A Long Way from Chicago, #2);Richard Peck;eng;4.1
5021;;Own the Wind (Chaos, #1);Kristen Ashley;eng;4.22
5022;8423648990;Marina;Carlos Ruiz Zafón;spa;3.99
5023;1594487588;My Name Is Memory;Ann Brashares;eng;3.7
5024;679744479;Written on the Body;Jeanette Winterson;en-US;4.08
5025;1450595987;Tiger's Voyage (The Tiger Saga, #3);Colleen Houck;eng;4.35
5026;7203116;Dead and Alive (Dean Koontz's Frankenstein, #3);Dean Koontz;eng;4.01
5027;60894083;Genome: the Autobiography of a Species in 23 Chapters;Matt Ridley;en-US;4.02
5028;671449028;The Going-To-Bed Book;Sandra Boynton;en-US;4.22
5029;64473627;Knocked Out by My Nunga-Nungas (Confessions of Georgia Nicolson, #3);Louise Rennison;en-US;3.97
5030;842332294;Desecration (Left Behind, #9);Tim LaHaye, Jerry B. Jenkins;en-US;4.0
5031;1594204993;Redeployment;Phil Klay;eng;3.98
5032;385733976;Going Bovine;Libba Bray;eng;3.65
5033;752861743;The Postman Always Rings Twice;James M. Cain;eng;3.81
5034;385736843;The Dead-Tossed Waves (The Forest of Hands and Teeth, #2);Carrie Ryan;en-US;3.91
5035;965925072;Shadow Divers;Robert Kurson;eng;4.26
5036;385907508;Moon Over Manifest;Clare Vanderpool;eng;4.02
5037;375758771;The Glass Palace;Amitav Ghosh;eng;3.94
5038;1595144358;Chopsticks;Jessica Anthony, Rodrigo Corral;eng;3.72
5039;125001011X;Every Fifteen Minutes;Lisa Scottoline;en-CA;3.72
5040;385741391;The Eye of Minds (The Mortality Doctrine, #1);James Dashner;eng;3.85
5041;1579126936;4:50 from Paddington (Miss Marple, #8);Agatha Christie;eng;3.92
5042;749934123;Ceremony in Death (In Death, #5);J.D. Robb;eng;4.26
5043;345807154;Cockroaches (Harry Hole, #2);Jo Nesbø, Don Bartlett;eng;3.71
5044;425212033;Grave Surprise (Harper Connelly, #2);Charlaine Harris;en-US;3.88
5045;60535032;City of the Beasts (Eagle and Jaguar, #1);Isabel Allende, Margaret Sayers Peden;eng;3.69
5046;9770915343;أولاد حارتنا;Naguib Mahfouz, نجيب محفوظ;ara;4.1
5047;345460014;The Scar (Bas-Lag, #2);China Miéville;eng;4.15
5048;60751649;Haunted (The Mediator, #5);Meg Cabot;eng;4.15
5049;689860064;Dragondrums (Harper Hall, #3);Anne McCaffrey;eng;4.04
5050;446574465;The Story of Beautiful Girl;Rachel Simon;;3.92
5051;140280553;Galileo's Daughter: A Historical Memoir of Science, Faith and Love;Dava Sobel;en-US;3.74
5052;553241605;Mila 18;Leon Uris;eng;4.27
5053;545176867;Drawing from Memory;Allen Say;eng;3.81
5054;071956896X;Sea of Poppies (Ibis Trilogy, #1);Amitav Ghosh;eng;3.93
5055;553290991;Nightfall;Isaac Asimov, Robert Silverberg;eng;4.01
5056;152018484;How I Became a Pirate;Melinda Long, David Shannon;eng;4.07
5057;61129763;The Monkey Wrench Gang (Monkey Wrench Gang, #1);Edward Abbey;en-US;4.08
5058;1400063841;Last Night in Twisted River;John Irving;eng;3.74
5059;006204964X;Love Wins: A Book About Heaven, Hell, and the Fate of Every Person Who Ever Lived;Rob Bell;eng;3.54
5060;451233182;Bite Club (The Morganville Vampires, #10);Rachel Caine;eng;4.23
5061;312933541;A Matter of Honor;Jeffrey Archer;;3.9
5062;743482883;Mr. Perfect;Linda Howard;eng;4.07
5063;;Up to Me (The Bad Boys, #2);M. Leighton;eng;4.12
5064;;Waking Up Married (Waking Up, #1);Mira Lyn Kelly;en-US;3.53
5065;055380555X;No Time for Goodbye (No Time For Goodbye #1);Linwood Barclay;eng;4.0
5066;60730269;Ida B. . . and Her Plans to Maximize Fun, Avoid Disaster, and (Possibly) Save the World;Katherine Hannigan;eng;3.86
5067;7273746;The Dragon Keeper (Rain Wild Chronicles, #1);Robin Hobb;eng;3.93
5068;195007778;A Sand County Almanac and Sketches Here and There;Aldo Leopold;;4.24
5069;805072063;Lassie Come-Home;Eric Knight, Marguerite Kirmse;;4.16
5070;1932100660;The China Study: The Most Comprehensive Study of Nutrition Ever Conducted And the Startling Implications for Diet, Weight Loss, And Long-term Health;T. Colin Campbell, Thomas M. Campbell II;en-GB;4.21
5071;333710932;The Gruffalo;Julia Donaldson, Axel Scheffler;eng;4.47
5072;345455290;The Salmon of Doubt (Dirk Gently, #3);Douglas Adams;eng;3.92
5073;1857987632;The City and the Stars;Arthur C. Clarke;eng;4.08
5074;2723495612;Tokyo Ghoul, tome 1 (Tokyo Ghoul, #1);Sui Ishida, 石田 スイ;fre;4.43
5075;316737372;How to Train Your Dragon (How to Train Your Dragon, #1);Cressida Cowell;en-US;3.85
5076;034911188X;Brief Interviews with Hideous Men;David Foster Wallace;eng;3.88
5077;1416516727;All Around the Town;Mary Higgins Clark;;3.94
5078;61767581;L.A. Candy (L.A. Candy, #1);Lauren Conrad;en-US;3.36
5079;1440154236;The Siren;Kiera Cass;eng;3.78
5080;340686030;The Quiet Game;Greg Iles;eng;4.17
5081;679764410;American Sphinx: The Character of Thomas Jefferson;Joseph J. Ellis;eng;3.9
5082;307948684;Headhunters;Jo Nesbø, Don Bartlett;eng;3.78
5083;399153357;The Messenger (Gabriel Allon, #6);Daniel Silva;eng;4.18
5084;141023422;The Sheltering Sky;Paul Bowles;eng;3.92
5085;1406331163;The Rest of Us Just Live Here;Patrick Ness;eng;3.76
5086;345495357;The Lady Elizabeth;Alison Weir;eng;3.97
5087;1455503258;The Astronaut Wives Club;Lily Koppel;eng;3.26
5088;375757910;The Man Who Was Thursday: A Nightmare;G.K. Chesterton, Jonathan Lethem;eng;3.85
5089;006008460X;Cheaper by the Dozen;Frank B. Gilbreth Jr., Ernestine Gilbreth Carey;eng;3.99
5090;446581194;The Monster of Florence;Douglas Preston, Mario Spezi;en-US;3.72
5091;031605755X;Winter's Bone;Daniel Woodrell;eng;3.92
5092;553816322;Seduced by Moonlight (Merry Gentry, #3);Laurell K. Hamilton;eng;4.05
5093;60888644;Sword Song (The Saxon Stories, #4);Bernard Cornwell;en-US;4.28
5094;61251348;Deceptively Delicious: Simple Secrets to Get Your Kids Eating Good Food;Jessica Seinfeld;en-US;3.39
5095;316780375;The Weight of Water;Anita Shreve;eng;3.62
5096;1301786454;Music of the Heart (Runaway Train, #1);Katie Ashley;eng;4.0
5097;451203771;Scarlet Feather;Maeve Binchy;eng;3.93
5098;988489112;Truth (Consequences, #2);Aleatha Romig;eng;4.38
5099;60507772;The Last Hero (Discworld, #27: Rincewind #7);Terry Pratchett, Paul Kidby;eng;4.15
5100;553275720;Fantastic Voyage;Isaac Asimov;;3.89
5101;312243359;We Wish to Inform You That Tomorrow We Will Be Killed with Our Families;Philip Gourevitch;en-US;4.3
